Domicilio,Facultad,Municipio,Pais,Provincia,Universidad,index,lat,lng
Alberdi 47 - San Salvador De Jujuy - Jujuy ,Facultad de Ciencias Agrarias,Dr Manuel Belgrano,ARG,Jujuy,Universidad Nacional de Jujuy,1336,-24.1876412,-65.2891476
Ruta Provincial N 1 Km 4 sn - Comodoro Rivadavia - Chubut ,Facultad de Ciencias Naturales y Ciencias de la Salud - Sede Comodoro Rivadavia,Escalante,ARG,Chubut,Universidad Nacional de la Patagonia San Juan Bosco,1343,-45.8657412,-67.5026264
Ruta 258 Km 4 sn - Esquel - Chubut ,Facultad de Ciencias Naturales y Ciencias de la Salud - Sede Esquel,Futaleufú,ARG,Chubut,Universidad Nacional de la Patagonia San Juan Bosco,1347,-42.920707,-71.3149922
Boulevard Almirante Brown 3700 - Puerto Madryn - Chubut ,Facultad de Ciencias Naturales y Ciencias de la Salud - Sede Puerto Madryn,Biedma,ARG,Chubut,Universidad Nacional de la Patagonia San Juan Bosco,1348,-42.78313,-65.01475
Belgrano 504 - Trelew - Chubut ,Facultad de Ciencias Naturales y Ciencias de la Salud - Sede Trelew,Rawson,ARG,Chubut,Universidad Nacional de la Patagonia San Juan Bosco,1349,-43.2541888,-65.30636
115 y 47 - - La Plata - Buenos Aires ,Facultad de Ciencias Exactas,La Plata,ARG,Buenos Aires,Universidad Nacional de La Plata,1354,-34.8478691,-58.0825936
60 y 122 - - La Plata - Buenos Aires ,Facultad de Ciencias Naturales y Museo,La Plata,ARG,Buenos Aires,Universidad Nacional de La Plata,1355,-34.911932,-57.9316786
60 y 118 - - La Plata - Buenos Aires ,Facultad de Ciencias Veterinarias,La Plata,ARG,Buenos Aires,Universidad Nacional de La Plata,1359,-34.892548,-57.956792
Castro Barros S/Nº - Chamical - La Rioja ,Sede Chamical,Chamical,ARG,La Rioja,Universidad Nacional de La Rioja,1360,-30.36845,-66.31295
Av. San Martin 462 - Chepes - La Rioja ,Sede Universitaria Chepes,Rosario Vera Peñaloza,ARG,La Rioja,Universidad Nacional de La Rioja,1363,-31.341184,-66.5866158
República de Italia 780 - Azul - Buenos Aires ,Facultad de Agronomía,Azul,ARG,Buenos Aires,Universidad Nacional del Centro de la Provincia de Buenos Aires,1364,-36.7684624,-59.8794474
Arroyo Seco SN - Tandil - Buenos Aires ,Facultad de Ciencias Exactas,Tandil,ARG,Buenos Aires,Universidad Nacional del Centro de la Provincia de Buenos Aires,310,-37.34123,-59.10922
Avenida del Valle 5737 - Olavarria - Buenos Aires ,Facultad de Ingeniería,Olavarría,ARG,Buenos Aires,Universidad Nacional del Centro de la Provincia de Buenos Aires,1368,-36.9172196,-60.3035118
B° Jardín Botánico- calle Quintral S/Nº - San Carlos De Bariloche - Río Negro ,Centro Regional Universitario Bariloche,Bariloche,ARG,Rio Negro,Universidad Nacional del Comahue,1369,-41.14317,-71.31808
9 de Julio 1449 - Corrientes - Corrientes ,Facultad de Ciencias Exactas y Naturales y Agrimensura,Corrientes,ARG,Corrientes,Universidad Nacional del Nordeste,1374,-27.4668,-58.8323003
Roque Saenz Peña 456 - Junin - Buenos Aires ,"Escuela de Ciencias Agrarias, Naturales y Ambientales",Junín,ARG,Buenos Aires,Universidad Nacional del Noroeste de la Provincia de Buenos Aires,1376,-34.5853948,-60.9495952
Juan XXIII y Ruta Provincial Nº 4 s/n - Lomas De Zamora - Buenos Aires ,Facultad de Ciencias Agrarias,Lomas de Zamora,ARG,Buenos Aires,Universidad Nacional de Lomas de Zamora,1377,-34.7418695,-58.3721061
San Juan 670 - Bahia Blanca - Buenos Aires ,"Departamento de Biología, Bioquímica y Farmacia",Bahía Blanca,ARG,Buenos Aires,Universidad Nacional del Sur,356,-38.7023215,-62.2693538
Alem 1253 - Bahia Blanca - Buenos Aires ,Departamento de Química,Bahía Blanca,ARG,Buenos Aires,Universidad Nacional del Sur,1381,-38.7017258,-62.2708281
Vicente Lopéz y Bertolini S/N - Campana - Buenos Aires ,Centro Regional Campana,Campana,ARG,Buenos Aires,Universidad Nacional de Luján,1382,-34.18053,-58.94717
Funes (Complejo Universitario) 3350 - Mar Del Plata - Buenos Aires ,Facultad de Ciencias Exactas y Naturales,General Pueyrredón,ARG,Buenos Aires,Universidad Nacional de Mar del Plata,370,-38.0266709,-57.620948
FELIX DE AZARA 1552 - Posadas - Misiones ,"Facultad de Ciencias Exactas, Químicas y Naturales",Posadas,ARG,Misiones,Universidad Nacional de Misiones,1388,-27.3646974,-55.8932968
CALLE BERTONI 124 - Eldorado - Misiones ,Facultad de Ciencias Forestales,Eldorado,ARG,Misiones,Universidad Nacional de Misiones,1390,-26.39786,-54.66608
Ruta 36 Km 601 - Rio Cuarto - Córdoba ,"Facultad de Ciencias Exactas, Físico-Químicas y Naturales",Río Cuarto,ARG,Cordoba,Universidad Nacional de Río Cuarto,386,-32.4586709,-64.3862245
Don Bosco y Leloir s/n - Viedma - Río Negro ,Unidad Académica Sede Atlántica,Adolfo Alsina,ARG,Rio Negro,Universidad Nacional de Río Negro,1397,-40.82209,-62.97714
Campo Exp. J.Villarino - - Zavalla - Santa Fé ,Facultad de Ciencias Agrarias,Rosario,ARG,Santa Fe,Universidad Nacional de Rosario,1398,-33.02285,-60.87928
Avenida Bolivia 5150 - Salta - Salta ,Facultad de Ciencias Naturales,Salta,ARG,Salta,Universidad Nacional de Salta,1400,-24.76073,-65.4148699
Av. Güiraldes 689 - San Antonio De Areco - Buenos Aires ,Escuela de Desarrollo Productivo y Tecnológico,San Antonio de Areco,ARG,Buenos Aires,Universidad Nacional de San Antonio de Areco,1403,-34.2573275,-59.47979
Av. Güiraldes 689 - San Antonio De Areco - Buenos Aires ,Sede San Antonio de Areco,San Antonio de Areco,ARG,Buenos Aires,Universidad Nacional de San Antonio de Areco,1403,-34.2573275,-59.47979
Avda. Ejercito de los Andes 950 - San Luis - San Luis ,"Facultad de Química, Bioquímica y Farmacia",Juan Martín de Pueyrredón,ARG,San Luis,Universidad Nacional de San Luis,1215,-33.291382,-66.3379054
Av. Belgrano (S) 1912 - Santiago Del Estero - Santiago Del Estero ,Facultad de Ciencias Forestales,Santiago del Estero,ARG,Santiago Del Estero,Universidad Nacional de Santiago del Estero,1411,-27.764688,-64.2826822
Onas 450 - Ushuaia - Tierra Del Fuego ,"Instituto de Ciencias Polares, Ambiente y Recursos Naturales",Ushuaia,ARG,Tierra Del Fuego,"Universidad Nacional de Tierra del Fuego, Antártida e Islas del Atlántico Sur",416,-54.8072959,-68.3203366
Arturo Jauretche 1555 - Villa María - Córdoba ,Instituto Académico Pedagógico de Ciencias Básicas y Aplicadas,Santa María,ARG,Cordoba,Universidad Nacional de Villa María,679,-31.6504,-64.41262
Las Heras 383 - Villa Mercedes - San Luis ,Escuela de Ciencias Ambientales y Biotecnología,General Pedernera,ARG,San Luis,Universidad Nacional de Villa Mercedes,1418,-33.6851595,-65.4694484
Av. Cárcano - Bº Chateau Carreras 3590 - Córdoba - Córdoba ,Facultad de Turismo y Ambiente,Córdoba,ARG,Cordoba,Universidad Provincial de Córdoba,1419,-31.37591,-64.25406
Av. Buque Pesquero Dorrego 281 - Mar Del Plata - Buenos Aires ,Unidad Académica Mar del Plata,General Pueyrredón,ARG,Buenos Aires,Universidad Tecnológica Nacional,1420,-38.0494062,-57.5430918
Potosi 4240 - Ciudad Autonoma de Buenos Aires - Ciudad Autonoma de Buenos Aires ,Instituto Universitario Escuela de Medicina del Hospital Italiano - UA,Ciudad de Buenos Aires,ARG,Ciudad Autonoma De Buenos Aires,Instituto Universitario Escuela de Medicina del Hospital Italiano,1421,-34.60728,-58.42681
Bartolomé Mitre 1411 - Ciudad Autonoma de Buenos Aires - Ciudad Autonoma de Buenos Aires ,Facultad de Ciencias de la Salud,Ciudad de Buenos Aires,ARG,Ciudad Autonoma De Buenos Aires,Universidad Argentina John F. Kennedy,30,-34.60765,-58.3865
Av. Armada Argentina 3555 - Córdoba - Córdoba ,Facultad de Ciencias Químicas,Córdoba,ARG,Cordoba,Universidad Católica de Córdoba,482,-31.4858262,-64.2464424
Chorroarín 280 - Ciudad Autonoma de Buenos Aires - Ciudad Autonoma de Buenos Aires ,Facultad de Ciencias Veterinarias,Ciudad de Buenos Aires,ARG,Ciudad Autonoma De Buenos Aires,Universidad de Buenos Aires,1430,-34.5962099,-58.4775
Junín 954 - Ciudad Autonoma de Buenos Aires - Ciudad Autonoma de Buenos Aires ,Facultad de Farmacia y Bioquímica,Ciudad de Buenos Aires,ARG,Ciudad Autonoma De Buenos Aires,Universidad de Buenos Aires,1431,-34.597903,-58.3974584
Avenida de Acceso Este 2245 - San Jose (Dpto. Guaymallen) - Mendoza ,Facultad de Farmacia y Bioquímica,Guaymallén,ARG,Mendoza,Universidad Juan Agustín Maza,900,-32.89729,-68.8119967
Av San Martín 2002 - Florencio Varela - Buenos Aires ,Instituto de Ciencias de la Salud,Florencio Varela,ARG,Buenos Aires,Universidad Nacional Arturo Jauretche,1443,-34.7963106,-58.2786386
Avda.Enrique Barros - Cd.Universitaria S/N - Córdoba - Córdoba ,Facultad de Ciencias Médicas - Escuela de Tecnología Médica,Córdoba,ARG,Cordoba,Universidad Nacional de Córdoba,1445,-31.43622,-64.18805
Haya de la Torre y Avda. Medina Allende S/N - Córdoba - Córdoba ,Facultad de Ciencias Químicas,Córdoba,ARG,Cordoba,Universidad Nacional de Córdoba,1446,-31.43708,-64.19376
Pte Perón Pta Alta 64 - Gualeguaychu - Entre Ríos ,Facultad de Bromatología,Gualeguaychú,ARG,Entre Rios,Universidad Nacional de Entre Ríos,1448,-33.01654,-58.4724769
Cmdte Fernandez 755 - Presidencia Roque Saenz Peña - Chaco ,Departamento de Ciencias Basicas y Aplicadas,Comandante Fernandez,ARG,Chaco,Universidad Nacional del Chaco Austral,1459,-26.7898299,-60.45334
Comandante. Fernández 755 - Presidencia Roque Saenz Peña - Chaco ,Rectorado,Comandante Fernandez,ARG,Chaco,Universidad Nacional del Chaco Austral,1460,-26.7898299,-60.45334
Avenida Alem 1253 - Bahia Blanca - Buenos Aires ,Departamento de Física,Bahía Blanca,ARG,Buenos Aires,Universidad Nacional del Sur,1089,-38.7017258,-62.2708281
Suipacha 531 - Rosario - Santa Fé ,Facultad de Ciencias Bioquímicas y Farmacéuticas,Rosario,ARG,Santa Fe,Universidad Nacional de Rosario,1470,-32.9058483,-60.8132872
Ayacucho 1667 - Rosario - Santa Fé ,Instituto Politécnico Superior General San Martín,Rosario,ARG,Santa Fe,Universidad Nacional de Rosario,1478,-32.9588753,-60.6295231
Ayacucho 491 - San Miguel De Tucuman - Tucumán ,"Facultad de Bioquímica, Química y Farmacia",San Miguel de Tucumán,ARG,Tucuman,Universidad Nacional de Tucumán,1482,-26.8365804,-65.2109167
av alicia moreau de justo 1500 1500 - Ciudad Autonoma de Buenos Aires - Ciudad Autonoma de Buenos Aires ,Facultad de Ingeniería y Ciencias Agrarias,Ciudad de Buenos Aires,ARG,Ciudad Autonoma De Buenos Aires,Pontificia Universidad Católica Argentina Santa María de los Buenos Aires,1485,-34.61572,-58.36597
Gral. San Martín y Enrique Carbó -- - Paraná - Entre Ríos ,Facultad de Ciencias de la Vida y la Salud. Sede Paraná,Gualeguaychú,ARG,Entre Rios,Universidad Autónoma de Entre Ríos,1489,-33.14674,-59.20819
3 de Febrero e H. Yrigoyen -- - Basavilbaso - Entre Ríos ,Facultad de Ciencia y Tecnología. Sede Basavilbaso,Uruguay,ARG,Entre Rios,Universidad Autónoma de Entre Ríos,1490,-32.37757,-58.87626
Las Violeta 853 - Chajari - Entre Ríos ,Facultad de Ciencia y Tecnología. Sede Chajarí,Federación,ARG,Entre Rios,Universidad Autónoma de Entre Ríos,1491,-30.75447,-57.98479
3 de Febrero e H. Yrigoyen -- - Crespo - Entre Ríos ,Facultad de Ciencia y Tecnología. Sede Crespo,Paraná,ARG,Entre Rios,Universidad Autónoma de Entre Ríos,1492,-32.03475,-60.30615
Corrientes 198 - Gualeguay - Entre Ríos ,Facultad de Ciencia y Tecnología. Sede Gualeguay,Gualeguay,ARG,Entre Rios,Universidad Autónoma de Entre Ríos,1493,-33.1492218,-59.3082532
Héctor Maya y Cuesta de los Troperos -- - El Quebracho - Entre Ríos ,Facultad de Ciencia y Tecnología. Sede Santa Elena,Paraná,ARG,Entre Rios,Universidad Autónoma de Entre Ríos,1495,-31.82209,-60.25399
RN Nº130 Km. 81 -- - Villaguay - Entre Ríos ,Facultad de Ciencia y Tecnología. Sede Villaguay,Villaguay,ARG,Entre Rios,Universidad Autónoma de Entre Ríos,1496,-31.85794,-59.03687
Av. Armada Argentina 3555 - Córdoba - Córdoba ,Facultad de Ciencias Agropecuarias,Córdoba,ARG,Cordoba,Universidad Católica de Córdoba,482,-31.4858262,-64.2464424
Campo Castañares s/n S/N - Salta - Salta ,Facultad de Ciencias Agrarias y Veterinarias,Salta,ARG,Salta,Universidad Católica de Salta,88,-65.3940388,-24.7399601
Federico Lacroze 1955 - Ciudad Autonoma de Buenos Aires - Ciudad Autonoma de Buenos Aires ,Facultad de Ciencias Agrarias,Ciudad de Buenos Aires,ARG,Ciudad Autonoma De Buenos Aires,Universidad de Belgrano,1501,-34.5657843,-58.443185
Eurasquin 158 - Concepcion Del Uruguay - Entre Ríos ,Facultad de Ciencias Agrarias,Uruguay,ARG,Entre Rios,Universidad de Concepción del Uruguay,1508,-32.48654,-58.24762
Gob. Virasoro Lavalle 535 .. - Santo Tome - Corrientes ,Delegación Provincia de Corrientes y Región Noreste,Lavalle,ARG,Corrientes,Universidad del Salvador,1510,-29.03448,-59.18336
Machado 854 - Moron - Buenos Aires ,Facultad de Agronomía y Ciencias Agroalimentarias,Morón,ARG,Buenos Aires,Universidad de Morón,162,-34.6464148,-58.6204543
Av. San Martín 2002 - Florencio Varela - Buenos Aires ,Instituto de Ingeniería y Agronomía,Florencio Varela,ARG,Buenos Aires,Universidad Nacional Arturo Jauretche,1517,-34.7963106,-58.2786386
Avenida Belgrano y Maestro Qiroga s/n - San Fernando del Valle de Catamarca - Catamarca ,Facultad de Ciencias Agrarias,San Fernando del Valle de Catamarca,ARG,Catamarca,Universidad Nacional de Catamarca,1518,-28.4605,-65.77861
Av. Valparaíso y Rogelio Martínez - C.U. . - Córdoba - Córdoba ,Facultad de Ciencias Agropecuarias,Córdoba,ARG,Cordoba,Universidad Nacional de Córdoba,1522,-31.4292,-64.16082
Marquez de Aguado 210 - General Alvear - Mendoza ,Facultad de Ciencias Agrarias - Delegación General Alvear,General Alvear,ARG,Mendoza,Universidad Nacional de Cuyo,1525,-34.97384,-67.6865371
Monseñor Tavella 1450 - Concordia - Entre Ríos ,Facultad de Ciencias de la Alimentación,Concordia,ARG,Entre Rios,Universidad Nacional de Entre Ríos,1528,-31.3817664,-58.0221144
Avenida Gobernador Gutnisky 3200 - Formosa - Formosa ,Facultad de Recursos Naturales,Formosa,ARG,Formosa,Universidad Nacional de Formosa,230,-26.1292902,-58.1494648
Ruta 35 Km 334 - Santa Rosa - La Pampa ,Facultad de Agronomía,Santa Rosa,ARG,La Pampa,Universidad Nacional de La Pampa,1534,-36.62256,-64.27108
Calle 60 esq. 119 - - La Plata - Buenos Aires ,Facultad de Ciencias Agrarias y Forestales,La Plata,ARG,Buenos Aires,Universidad Nacional de La Plata,1541,-34.9107029,-57.9311966
Castro Barros S/N s/n - Desiderio Tello - La Rioja ,Extensión Catuna,Rosario Vera Peñaloza,ARG,La Rioja,Universidad Nacional de La Rioja,1544,-31.21204,-66.3157
"Ruta 151 Km 12,5 SN - Cinco Saltos - Río Negro ",Facultad de Ciencias Agrarias,General Roca,ARG,Rio Negro,Universidad Nacional del Comahue,1555,-38.8317399,-68.0579648
RP Luis Kreder 2805 - Esperanza - Santa Fé ,Facultad de Ciencias Agrarias,Las Colonias,ARG,Santa Fe,Universidad Nacional del Litoral,1557,-31.4496,-60.9295
Av. P. Kreder 2805 - Esperanza - Santa Fé ,Facultad de Ciencias Veterinarias,Las Colonias,ARG,Santa Fe,Universidad Nacional del Litoral,1559,-31.4496,-60.9295
Sargento Cabral 2131 - Corrientes - Corrientes ,Facultad de Ciencias Agrarias,Corrientes,ARG,Corrientes,Universidad Nacional del Nordeste,1560,-27.4595856,-58.8225945
Juan XXIII y Ruta Provincial Nº 4 s/n - Lomas De Zamora - Buenos Aires ,Facultad de Ingeniería,Lomas de Zamora,ARG,Buenos Aires,Universidad Nacional de Lomas de Zamora,1377,-34.7418695,-58.3721061
San Andrés 800 - Bahia Blanca - Buenos Aires ,Departamento de Agronomía,Bahía Blanca,ARG,Buenos Aires,Universidad Nacional del Sur,1573,-38.69548,-62.2542867
"Ruta 226 Km 72,3 - Balcarce - Buenos Aires ",Facultad de Ciencias Agrarias,General Belgrano,ARG,Buenos Aires,Universidad Nacional de Mar del Plata,1577,-35.7724925,-58.4863281
Ruta 36 Km. 601 - Rio Cuarto - Córdoba ,Facultad de Agronomía y Veterinaria,Río Cuarto,ARG,Cordoba,Universidad Nacional de Río Cuarto,1584,-32.4586709,-64.3862245
ALVARADO 751 - San Ramon De La Nueva Oran - Salta ,Sede Regional Orán,Orán,ARG,Salta,Universidad Nacional de Salta,1593,-23.13497,-64.31844
Coronel Vidt 346 - Metan - Salta ,Sede Regional Sur Metán - Rosario de la Frontera,Metán,ARG,Salta,Universidad Nacional de Salta,1594,-25.50696,-64.9733
Av. Lib. Gral San Martín (Oeste) 1109 - San Juan - San Juan ,Facultad de Ingeniería,San Martín,ARG,San Juan,Universidad Nacional de San Juan,1599,-31.54441,-68.21157
Av. Belgrano (S) 1912 - Santiago Del Estero - Santiago Del Estero ,Facultad de Agronomía y Agroindustrias,Santiago del Estero,ARG,Santiago Del Estero,Universidad Nacional de Santiago del Estero,1411,-27.764688,-64.2826822
Av. Roca 1900 - San Miguel De Tucuman - Tucumán ,Facultad de Agronomía y Zootecnia,San Miguel de Tucumán,ARG,Tucuman,Universidad Nacional de Tucumán,1610,-26.80773,-65.25292
Salta 277 - Concordia - Entre Ríos ,Facultad Regional Concordia,Concordia,ARG,Entre Rios,Universidad Tecnológica Nacional,1615,-31.3941316,-58.0121393
Calle 44 1000 Par - Reconquista - Santa Fé ,Facultad Regional Reconquista,General Obligado,ARG,Santa Fe,Universidad Tecnológica Nacional,1619,-29.1575918,-59.6501428
French 414 - Resistencia - Chaco ,Facultad Regional Resistencia,San Fernando,ARG,Chaco,Universidad Tecnológica Nacional,1621,-27.4509625,-58.9793641
Avda. de la Universidad 501 - San Francisco - Córdoba ,Facultad Regional San Francisco,San Justo,ARG,Cordoba,Universidad Tecnológica Nacional,1623,-31.42075,-62.10928
Colón 332 - San Nicolas - Buenos Aires ,Facultad Regional San Nicolás,San Nicolás,ARG,Buenos Aires,Universidad Tecnológica Nacional,1625,-33.333155,-60.206018
Racedo 298 - Trenque Lauquen - Buenos Aires ,Facultad Regional Trenque Lauquen,Trenque Lauquen,ARG,Buenos Aires,Universidad Tecnológica Nacional,1627,-35.9857112,-62.7270521
Av. Universidad 450 - Villa María - Córdoba ,Facultad Regional Villa María,General San Martín,ARG,Cordoba,Universidad Tecnológica Nacional,1629,-32.4086,-63.2170053
25 Mayo 544 - Ciudad Autonoma de Buenos Aires - Ciudad Autonoma de Buenos Aires ,Departamento de Humanidades,Ciudad de Buenos Aires,ARG,Ciudad Autonoma De Buenos Aires,"Instituto Universitario Nacional de Derechos Humanos ""Madres de Plaza de Mayo""",1633,-34.60147,-58.37122
25 de Mayo 99 - Libertador General San Martín - Entre Ríos ,"Facultad de Humanidades, Educación y Ciencias Sociales",Diamante,ARG,Entre Rios,Universidad Adventista del Plata,1641,-32.0760348,-60.464128
Cerrito 1250 - Ciudad Autonoma de Buenos Aires - Ciudad Autonoma de Buenos Aires ,Facultad de Comunicación,Ciudad de Buenos Aires,ARG,Ciudad Autonoma De Buenos Aires,Universidad Austral,1656,-34.59351,-58.38275
Cura Alvarez 774 - Paraná - Entre Ríos ,Facultad de Ciencia y Tecnología. Sede Paraná,Paraná,ARG,Entre Rios,Universidad Autónoma de Entre Ríos,1664,-31.744414,-60.5236192
Zabala 1837 - Ciudad Autonoma de Buenos Aires - Ciudad Autonoma de Buenos Aires ,Facultad de Derecho y Ciencias Sociales,Ciudad de Buenos Aires,ARG,Ciudad Autonoma De Buenos Aires,Universidad de Belgrano,110,-34.5645538,-58.4441269
Marcelo T. de Alvear 2230 - Ciudad Autonoma de Buenos Aires - Ciudad Autonoma de Buenos Aires ,Facultad de Ciencias Sociales,Ciudad de Buenos Aires,ARG,Ciudad Autonoma De Buenos Aires,Universidad de Buenos Aires,1693,-34.59698,-58.3995
Chacabuco 1177 - Reconquista - Santa Fé ,Convenio UTN - Reconquista,General Obligado,ARG,Santa Fe,Universidad de Ciencias Empresariales y Sociales,1703,-29.1499337,-59.6406558
Sarmiento 642 - Resistencia - Chaco ,Convenio UTN - Resistencia,San Fernando,ARG,Chaco,Universidad de Ciencias Empresariales y Sociales,1705,-27.45142,-58.98799
25 de Mayo 906 - Rafaela - Santa Fé ,Sede Rafaela,Castellanos,ARG,Santa Fe,Universidad de Ciencias Empresariales y Sociales,1712,-31.24376,-61.4906347
8 de junio 522 - Concepcion Del Uruguay - Entre Ríos ,Facultad de Ciencias de la Comunicación y de la Educación,Uruguay,ARG,Entre Rios,Universidad de Concepción del Uruguay,1718,-32.4819296,-58.2295955
Avellaneda 3345 - Mar Del Plata - Buenos Aires ,Facultad de Periodismo y Comunicación,General Pueyrredón,ARG,Buenos Aires,Universidad de la Fraternidad de Agrupaciones Santo Tomás de Aquino,1724,-38.0067948,-57.5635125
Pellegrini 1332 - Rosario - Santa Fé ,Facultad de Química,Rosario,ARG,Santa Fe,Universidad del Centro Educativo Latinoamericano,1729,-32.9967008,-60.7611702
Av. Corrientes 1723 - Ciudad Autonoma de Buenos Aires - Ciudad Autonoma de Buenos Aires ,Facultad de Ciencias Jurídicas y Sociales,Ciudad de Buenos Aires,ARG,Ciudad Autonoma De Buenos Aires,Universidad del Museo Social Argentino,1741,-34.6044,-58.39129
9 de Julio 165 - San Miguel De Tucuman - Tucumán ,"Facultad de Ciencias Juridicas, Politicas y Sociales",San Miguel de Tucumán,ARG,Tucuman,Universidad del Norte Santo Tomás de Aquino,146,-26.82355,-65.26626
Av. Callao 835 - Ciudad Autonoma de Buenos Aires - Ciudad Autonoma de Buenos Aires ,Facultad de Ciencias de la Educación y de la Comunicación Social,Ciudad de Buenos Aires,ARG,Ciudad Autonoma De Buenos Aires,Universidad del Salvador,1747,-34.59921,-58.39298
Vito Dumas 284 - Victoria - Buenos Aires ,Departamento de Ciencias Sociales,San Fernando,ARG,Buenos Aires,Universidad de San Andrés,1764,-34.4464719,-58.5312505
Av. libertador 17175 - Beccar - Buenos Aires ,Facultad de Ciencias Humanas y Sociales,San Isidro,ARG,Buenos Aires,"Universidad de San Isidro ""Dr. Plácido Marín""",1765,-34.4612733,-58.5185009
24 de Septiembre 476 - San Miguel De Tucuman - Tucumán ,"Instituto de Estudios Sociales, Politica y Cultura",San Miguel de Tucumán,ARG,Tucuman,Universidad de San Pablo T,595,-26.8310559,-65.204093
España 350 - Avellaneda - Buenos Aires ,Departamento de Ciencias Sociales,Avellaneda,ARG,Buenos Aires,Universidad Nacional de Avellaneda,194,-34.6628049,-58.3722248
9 de Julio 22 - Chilecito - La Rioja ,Escuela de Comunicación,Chilecito,ARG,La Rioja,Universidad Nacional de Chilecito,206,-29.17235,-67.49761
Bernardo de Yrigoyen 375 - San Rafael - Mendoza ,Facultad de Ciencias Políticas y Sociales - Delegación San Rafael,San Rafael,ARG,Mendoza,Universidad Nacional de Cuyo,1799,-34.6129971,-68.3268247
Alameda de la Federación 106 - Paraná - Entre Ríos ,Facultad de Ciencias de la Educación,Paraná,ARG,Entre Rios,Universidad Nacional de Entre Ríos,1800,-31.72321,-60.53317
Juan María Gutierrez 1150 - Los Polvorines - Buenos Aires ,Instituto del Desarrollo Humano,Malvinas Argentinas,ARG,Buenos Aires,Universidad Nacional de General Sarmiento,236,-34.5208625,-58.7003265
Otero 262 - San Salvador De Jujuy - Jujuy ,Facultad de Humanidades y Ciencias Sociales,Dr Manuel Belgrano,ARG,Jujuy,Universidad Nacional de Jujuy,1807,-24.1857618,-65.301496
Edificio Bosque: Diagonal 113 y 63 291 - La Plata - Buenos Aires ,Facultad de Periodismo y Comunicación Social,La Plata,ARG,Buenos Aires,Universidad Nacional de La Plata,1817,-34.912875,-57.9269551
Ruta Nacional Nº 60 sn - Aimogasta - La Rioja ,Sede Universitaria Aimogasta,La Rioja,ARG,La Rioja,Universidad Nacional de La Rioja,1827,-29.4099762,-66.8308636
Avenida del Valle 5737 - Olavarria - Buenos Aires ,Facultad de Ciencias Sociales,Olavarría,ARG,Buenos Aires,Universidad Nacional del Centro de la Provincia de Buenos Aires,1368,-36.9172196,-60.3035118
Mendoza 2159 - Gral. Roca - Río Negro ,Facultad de Derecho y Ciencias Sociales,General Roca,ARG,Rio Negro,Universidad Nacional del Comahue,1833,-37.87943,-67.7950199
Candido Pujato 2751 - Santa Fe - Santa Fé ,Facultad de Ciencias Jurídicas y Sociales,Santa Fe,ARG,Santa Fe,Universidad Nacional del Litoral,1835,-31.6337549,-60.7048203
San Juan 434 - Corrientes - Corrientes ,Facultad de Humanidades - Sede Corrientes,Corrientes,ARG,Corrientes,Universidad Nacional del Nordeste,1839,-27.4623693,-58.836405
Juan XXIII y Ruta Provincial Nº 4 s/n - Lomas De Zamora - Buenos Aires ,Facultad de Ciencias Sociales,Lomas de Zamora,ARG,Buenos Aires,Universidad Nacional de Lomas de Zamora,1377,-34.7418695,-58.3721061
Don Bosco 3729 - Ciudad Autonoma de Buenos Aires - Ciudad Autonoma de Buenos Aires ,Facultad de Ingeniería - sede CABA,Ciudad de Buenos Aires,ARG,Ciudad Autonoma De Buenos Aires,Universidad Nacional de Lomas de Zamora,1848,-34.61257,-58.41826
Bme. Mitre 1891 - Moreno - Buenos Aires ,Departamento de Humanidades y Ciencias Sociales,Morón,ARG,Buenos Aires,Universidad Nacional de Moreno,1858,-34.65294,-58.633274
Riobamba 250 bis - Rosario - Santa Fé ,Facultad de Ciencia Política y Relaciones Internacionales,Rosario,ARG,Santa Fe,Universidad Nacional de Rosario,1866,-32.9651736,-60.6303635
Avenida Bolivia 5150 - Salta - Salta ,Facultad de Humanidades,Salta,ARG,Salta,Universidad Nacional de Salta,1400,-24.76073,-65.4148699
WARNES 890 - Tartagal - Salta ,Sede Regional Tartagal,General José de San Martín,ARG,Salta,Universidad Nacional de Salta,1872,-22.5179348,-63.7974624
Av. Belgrano (S) 1912 - Santiago Del Estero - Santiago Del Estero ,Facultad de Ciencias Exactas y Tecnologías,Santiago del Estero,ARG,Santiago Del Estero,Universidad Nacional de Santiago del Estero,1411,-27.764688,-64.2826822
Av. Belgrano (S) 1912 - Santiago Del Estero - Santiago Del Estero ,"Facultad de Humanidades, Cs. Sociales y de la Salud",Santiago del Estero,ARG,Santiago Del Estero,Universidad Nacional de Santiago del Estero,1411,-27.764688,-64.2826822
Arturo Jauretche 1555 - Villa María - Córdoba ,Instituto Académico Pedagógico de Ciencias Sociales,Santa María,ARG,Cordoba,Universidad Nacional de Villa María,679,-31.6504,-64.41262
Las Heras 383 - Villa Mercedes - San Luis ,Escuela de Gestion de Empresas y Economia,General Pedernera,ARG,San Luis,Universidad Nacional de Villa Mercedes,1418,-33.6851595,-65.4694484
Juan José Paso 287 - Darragueira - Buenos Aires ,Sede Académica Darregueira,Puán,ARG,Buenos Aires,Universidad Provincial del Sudoeste,1893,-37.6926355,-63.1671356
Gorriti 132 - Bahia Blanca - Buenos Aires ,Facultad de Ciencias Sociales,Bahía Blanca,ARG,Buenos Aires,Universidad Salesiana Argentina,1895,-38.7178071,-62.2719751
