Domicilio,Facultad,Municipio,Pais,Provincia,Universidad,index,lat,lng
Av. Rivadavia 2258 - Ciudad Autonoma de Buenos Aires - Ciudad Autonoma de Buenos Aires ,Facultad de Humanidades,Ciudad de Buenos Aires,ARG,Ciudad Autonoma De Buenos Aires,Universidad de la Marina Mercante,144,-34.60968,-58.39841
Diagonal 80 723 - La Plata - Buenos Aires ,Facultad de Ciencias Humanas,La Plata,ARG,Buenos Aires,Universidad del Este,541,-34.9073787,-57.9489728
Rodriguez Peña 670 - Ciudad Autonoma de Buenos Aires - Ciudad Autonoma de Buenos Aires ,Escuela de Estudios Orientales,Ciudad de Buenos Aires,ARG,Ciudad Autonoma De Buenos Aires,Universidad del Salvador,551,-34.60114,-58.39138
Lavalle 1878 - Ciudad Autonoma de Buenos Aires - Ciudad Autonoma de Buenos Aires ,"Facultad de Filosofía, Letras y Estudios Orientales",Ciudad de Buenos Aires,ARG,Ciudad Autonoma De Buenos Aires,Universidad del Salvador,3420,-34.60319,-58.39354
Paseo Dr. Descotte 750 - Mendoza - Mendoza ,Facultad de Ingeniería,Mendoza,ARG,Mendoza,Universidad de Mendoza,552,-32.891485,-68.8612447
Machado 854 - Moron - Buenos Aires ,"Facultad de Filosofía, Ciencias de la Educación y Humanidades",Morón,ARG,Buenos Aires,Universidad de Morón,162,-34.6464148,-58.6204543
Vito Dumas 284 - Victoria - Buenos Aires ,Escuela de Educación,San Fernando,ARG,Buenos Aires,Universidad de San Andrés,1764,-34.4464719,-58.5312505
Entre Ríos 495 - Ciudad Autonoma de Buenos Aires - Ciudad Autonoma de Buenos Aires ,Facultad de Ciencias Humanas y de la Conducta,Ciudad de Buenos Aires,ARG,Ciudad Autonoma De Buenos Aires,Universidad Favaloro,3441,-34.614806,-58.393997
Hipólito Irigoyen y Pionero Engwald 0 - Eldorado - Misiones ,Departamento de Ciencias de la Salud Eldorado,Eldorado,ARG,Misiones,Universidad Gastón Dachary,2166,-26.41525,-54.61133
Av. Acceso Este 2245 - San Jose (Dpto. Guaymallen) - Mendoza ,Facultad de Educación,Guaymallén,ARG,Mendoza,Universidad Juan Agustín Maza,3445,-32.89729,-68.8119967
Sarmiento 2037 - Ciudad Autonoma de Buenos Aires - Ciudad Autonoma de Buenos Aires ,Facultad de Pedagogía,Ciudad de Buenos Aires,ARG,Ciudad Autonoma De Buenos Aires,Universidad Metropolitana para la Educación y el Trabajo,192,-34.6059,-58.39574
España 350 - Avellaneda - Buenos Aires ,Departamento de Salud y Actividad Física,Avellaneda,ARG,Buenos Aires,Universidad Nacional de Avellaneda,194,-34.6628049,-58.3722248
Maestro Quiroga s/n - San Fernando del Valle de Catamarca - Catamarca ,Facultad de Ciencias de la Salud,San Fernando del Valle de Catamarca,ARG,Catamarca,Universidad Nacional de Catamarca,2832,-28.46444,-65.79873
Ctro. Univ Parque G.San Martin Sin nro. - Mendoza - Mendoza ,Facultad de Educación,Mendoza,ARG,Mendoza,Universidad Nacional de Cuyo,3481,-32.88299,-68.876431
Centro de Estudios Tunuyán Sin nro. - Tunuyan - Mendoza ,Facultad de Educación - Delegación Tunuyán,Tunuyán,ARG,Mendoza,Universidad Nacional de Cuyo,3489,-33.57726,-69.0163
Bernardo de Irigoyen 350 Fac. - San Rafael - Mendoza ,Facultad de Filosofía y Letras - Delegación San Rafael,San Rafael,ARG,Mendoza,Universidad Nacional de Cuyo,3495,-34.61312,-68.3268885
Vergara 2222 - Hurlingham - Buenos Aires ,Instituto de Educación,Hurlingham,ARG,Buenos Aires,Universidad Nacional de Hurlingham,623,-34.6164566,-58.6342231
29 de Septiembre 3901 - Remedios de Escalada - Buenos Aires ,Departamento de Salud Comunitaria,Lanús,ARG,Buenos Aires,Universidad Nacional de Lanús,238,-34.7342286,-58.3901502
Ortiz de Ocampo S/N° - Olta - La Rioja ,Delegación Académica Olta,General Belgrano,ARG,La Rioja,Universidad Nacional de La Rioja,3548,-30.63073,-66.2647
Dalmacio Vélez Sarsfield y 9 de Julio sn - Punta De Los Llanos - La Rioja ,Delegación Académica Tama,La Rioja,ARG,La Rioja,Universidad Nacional de La Rioja,3549,-29.41492,-66.8472849
Bolívar 1674 - Ciudad Autonoma de Buenos Aires - Ciudad Autonoma de Buenos Aires ,Área transdepartamental de Formación Docente,Ciudad de Buenos Aires,ARG,Ciudad Autonoma De Buenos Aires,Universidad Nacional de las Artes,699,-34.62788,-58.3724
Irigoyen 2000 - Cipolletti - Río Negro ,Facultad de Ciencias de la Educación,General Roca,ARG,Rio Negro,Universidad Nacional del Comahue,3587,-38.94155,-67.9722634
Centenario 1399 - Merlo - Buenos Aires ,Escuela de Humanidades,Merlo,ARG,Buenos Aires,Universidad Nacional del Oeste,3010,-34.6730399,-58.6997501
Miguel Sanchez 1050 - Ciudad Autonoma de Buenos Aires - Ciudad Autonoma de Buenos Aires ,Facultad de Ciencias Sociales - sede CABA,Ciudad de Buenos Aires,ARG,Ciudad Autonoma De Buenos Aires,Universidad Nacional de Lomas de Zamora,3611,-34.60536,-58.46687
12 de Octubre y San Juan - - Bahia Blanca - Buenos Aires ,Departamento de Humanidades,Bahía Blanca,ARG,Buenos Aires,Universidad Nacional del Sur,3613,-38.7061599,-62.26391
Av. del Libertador 1700 - San Fernando - Buenos Aires ,Delegación Académica San Fernando,San Fernando,ARG,Buenos Aires,Universidad Nacional de Luján,3618,-34.44856,-58.53662
Ejército de los Andes 950 - San Luis - San Luis ,Facultad de Psicología,Juan Martín de Pueyrredón,ARG,San Luis,Universidad Nacional de San Luis,1216,-33.291382,-66.3379054
Dragones 2201 - Ciudad Autonoma de Buenos Aires - Ciudad Autonoma de Buenos Aires ,Instituto de Ciencias de la Rehabilitación y el Movimiento,Ciudad de Buenos Aires,ARG,Ciudad Autonoma De Buenos Aires,Universidad Nacional de San Martín,3675,-34.551954,-58.4417878
Av. Benjamin Araoz 751 - San Miguel De Tucuman - Tucumán ,Facultad de Educación Física,San Miguel de Tucumán,ARG,Tucuman,Universidad Nacional de Tucumán,3688,-26.8345623,-65.186552
Las Heras 383 - Villa Mercedes - San Luis ,Escuela de Ciencias de la Salud,General Pedernera,ARG,San Luis,Universidad Nacional de Villa Mercedes,1418,-33.6851595,-65.4694484
Leandro N. Alem 4731 - Jose Clemente Paz - Buenos Aires ,Departamento de Ciencias de la Salud y el Deporte,Leandro N. Alem,ARG,Buenos Aires,Universidad Nacional José C. Paz,1253,-34.51986,-61.3909
Paraguay 1255 - Ciudad Autonoma de Buenos Aires - Ciudad Autonoma de Buenos Aires ,Secretaría Académica,Ciudad de Buenos Aires,ARG,Ciudad Autonoma De Buenos Aires,Universidad Pedagógica Nacional,3700,-34.59814,-58.38486
Av. Cárcano 3590 y Deodoro Roca S/N s/n - Córdoba - Córdoba ,Facultad de Educación y Salud,Córdoba,ARG,Cordoba,Universidad Provincial de Córdoba,3705,-31.43203,-64.17022
París 532 - Haedo - Buenos Aires ,Facultad Regional Haedo,Morón,ARG,Buenos Aires,Universidad Tecnológica Nacional,3715,-34.6404207,-58.6014921
Almafuerte 1033 - Paraná - Entre Ríos ,Facultad Regional Paraná,Paraná,ARG,Entre Rios,Universidad Tecnológica Nacional,3717,-31.7500823,-60.5046888
Lavaise 610 - Santa Fe - Santa Fé ,Facultad Regional Santa Fé,Santa Fe,ARG,Santa Fe,Universidad Tecnológica Nacional,3722,-31.6169399,-60.6760305
Avenida Bolivia 5150 - Salta - Salta ,Facultad de Ciencias Exactas,Salta,ARG,Salta,Universidad Nacional de Salta,1400,-24.76073,-65.4148699
Av.Alicia Moreau de 1500 - Ciudad Autonoma de Buenos Aires - Ciudad Autonoma de Buenos Aires ,Facultad de Filosofía y Letras,Ciudad de Buenos Aires,ARG,Ciudad Autonoma De Buenos Aires,Pontificia Universidad Católica Argentina Santa María de los Buenos Aires,3734,-34.6237799,-58.36495
Obispo Trejo y Sanabria 323 - Córdoba - Córdoba ,Facultad de Filosofía y Humanidades,Córdoba,ARG,Cordoba,Universidad Católica de Córdoba,2455,-31.4194179,-64.1869724
Avda. José Ignacio de la Roza 1516 - San Juan - San Juan ,Facultad de Filosofía y Humanidades,San Juan,ARG,San Juan,Universidad Católica de Cuyo,76,-31.5376072,-68.5885474
Echacgüe 7151 - Santa Fe - Santa Fé ,Facultad de Filosofía,Santa Fe,ARG,Santa Fe,Universidad Católica de Santa Fe,3748,-31.5738299,-60.7438701
Pasaje 5 de Julio 489 - Ciudad Autonoma de Buenos Aires - Ciudad Autonoma de Buenos Aires ,Centro de Estudios de Filosofia y Teologia de la Orden de Predicadores,Ciudad de Buenos Aires,ARG,Ciudad Autonoma De Buenos Aires,Universidad del Norte Santo Tomás de Aquino,3754,-34.61338,-58.37116
9 de Julio 165 - San Miguel De Tucuman - Tucumán ,Facultad de Humanidades,San Miguel de Tucumán,ARG,Tucuman,Universidad del Norte Santo Tomás de Aquino,146,-26.82355,-65.26626
Vito Dumas 284 - Victoria - Buenos Aires ,Departamento de Humanidades,San Fernando,ARG,Buenos Aires,Universidad de San Andrés,1764,-34.4464719,-58.5312505
Juan Domingo Perón 3175 - Ciudad Autonoma de Buenos Aires - Ciudad Autonoma de Buenos Aires ,Facultad de Ingeniería y Ciencias Exactas y Naturales,Ciudad de Buenos Aires,ARG,Ciudad Autonoma De Buenos Aires,Universidad Favaloro,3803,-34.6077278,-58.4136839
Ctro. Atómico Bariloche-Av. E. Bustillo 9500 - San Carlos De Bariloche - Río Negro ,Instituto Balseiro,Bariloche,ARG,Rio Negro,Universidad Nacional de Cuyo,3809,-41.1149511,-71.4100261
Av. Pellegrini 250 - Rosario - Santa Fé ,"Facultad de Ciencias Exactas, Ingeniería y Agrimensura",Rosario,ARG,Santa Fe,Universidad Nacional de Rosario,3832,-32.95944,-60.6288801
Av. Figueroa Alcorta 7350 - Ciudad Autonoma de Buenos Aires - Ciudad Autonoma de Buenos Aires ,Departamento de Historia,Ciudad de Buenos Aires,ARG,Ciudad Autonoma De Buenos Aires,Universidad Torcuato Di Tella,689,-34.5478312,-58.4489132
Av. Eduardo Madero 399 - Ciudad Autonoma de Buenos Aires - Ciudad Autonoma de Buenos Aires ,Departamento de Industrial,Ciudad de Buenos Aires,ARG,Ciudad Autonoma De Buenos Aires,Instituto Tecnológico de Buenos Aires,2258,-34.60315,-58.36813
Mariano Acosta 1901 - Ciudad Autonoma de Buenos Aires - Ciudad Autonoma de Buenos Aires ,Facultad de Ingeniería,Ciudad de Buenos Aires,ARG,Ciudad Autonoma De Buenos Aires,Universidad Austral,3949,-34.6499097,-58.4621604
29 de septiembre 110 - Camps - Entre Ríos ,Facultad de Ciencias de la Vida y la Salud. Sede Ramírez,Nogoyá,ARG,Entre Rios,Universidad Autónoma de Entre Ríos,3950,-32.38409,-59.66435
Av. Armada Argentina 3555 - Córdoba - Córdoba ,Facultad de Ingeniería,Córdoba,ARG,Cordoba,Universidad Católica de Córdoba,482,-31.4858262,-64.2464424
Diagonal 73 2137 - La Plata - Buenos Aires ,Facultad de Ciencias Exáctas e Ingeniería,La Plata,ARG,Buenos Aires,Universidad Católica de La Plata,3973,-34.9216576,-57.9622086
Campo Castañares s/n S/N - Salta - Salta ,Facultad de Ingeniería,Salta,ARG,Salta,Universidad Católica de Salta,88,-65.3940388,-24.7399601
Pellegrini 790 - Salta - Salta ,Facultad Escuela de Negocios,Salta,ARG,Salta,Universidad Católica de Salta,3978,-24.7993558,-65.416152
Paseo Colón 850 - Ciudad Autonoma de Buenos Aires - Ciudad Autonoma de Buenos Aires ,Facultad de Ingeniería,Ciudad de Buenos Aires,ARG,Ciudad Autonoma De Buenos Aires,Universidad de Buenos Aires,3986,-34.6175111,-58.3700019
Viamonte 1816 - Ciudad Autonoma de Buenos Aires - Ciudad Autonoma de Buenos Aires ,Facultad de Ingeniería,Ciudad de Buenos Aires,ARG,Ciudad Autonoma De Buenos Aires,Universidad del Salvador,2695,-34.60084,-58.39301
Cabildo 134 - Moron - Buenos Aires ,Facultad de Ingeniería,Morón,ARG,Buenos Aires,Universidad de Morón,4014,-34.6471659,-58.61978
Mario Bravo 1050 - Ciudad Autonoma de Buenos Aires - Ciudad Autonoma de Buenos Aires ,Facultad de Ingeniería,Ciudad de Buenos Aires,ARG,Ciudad Autonoma De Buenos Aires,Universidad de Palermo,580,-34.59736,-58.41578
Salta 1968 - Posadas - Misiones ,Departamento de Ingeniería y Ciencias de la Producción,Posadas,ARG,Misiones,Universidad Gastón Dachary,184,-27.3714972,-55.8959452
San Martín 352 - San Rafael - Mendoza ,Facultad de Ciencias Aplicadas a la Industria,San Rafael,ARG,Mendoza,Universidad Nacional de Cuyo,4034,-34.5840998,-68.53894
Bernardo de Irigoyen 375 - General Alvear - Mendoza ,Facultad de Ciencias Aplicadas a la Industria - Delegación General Alvear,General Alvear,ARG,Mendoza,Universidad Nacional de Cuyo,1325,-34.9823645,-67.6919724
Bernardo de Irigoyen 343 - San Rafael - Mendoza ,Facultad de Ciencias Médicas - Delegación San Rafael,San Rafael,ARG,Mendoza,Universidad Nacional de Cuyo,2857,-34.6131487,-68.3269024
Gutnisky 3200 - Formosa - Formosa ,Facultad de Ciencias de la Salud,Formosa,ARG,Formosa,Universidad Nacional de Formosa,4048,-26.1933598,-58.1988695
Ruta Provincial Nº 1 - Km4 sn - Comodoro Rivadavia - Chubut ,Facultad de Ingeniería - Sede Comodoro Rivadavia,Escalante,ARG,Chubut,Universidad Nacional de la Patagonia San Juan Bosco,4068,-45.8657412,-67.5026264
1 y 47 - - La Plata - Buenos Aires ,Facultad de Ingeniería,La Plata,ARG,Buenos Aires,Universidad Nacional de La Plata,4071,-34.8995898,-57.9386198
Arroyo Seco SN - Tandil - Buenos Aires ,Facultad de Ciencias Veterinarias,Tandil,ARG,Buenos Aires,Universidad Nacional del Centro de la Provincia de Buenos Aires,310,-37.34123,-59.10922
Santiago del Estero 2829 - Santa Fe - Santa Fé ,Facultad de Ingeniería Química,Santa Fe,ARG,Santa Fe,Universidad Nacional del Litoral,4092,-31.6371967,-60.7069352
Newbery 355 - Junin - Buenos Aires ,Escuela de Tecnología,Junín,ARG,Buenos Aires,Universidad Nacional del Noroeste de la Provincia de Buenos Aires,4099,-34.5827267,-60.9434122
Roca 1632 - Avellaneda - Buenos Aires ,Facultad de Ingeniería -sede Avellaneda,Avellaneda,ARG,Buenos Aires,Universidad Nacional de Lomas de Zamora,4104,-34.6652447,-58.3531077
Juana Azurduy 218 - Hurlingham - Buenos Aires ,Facultad de Ingeniería - sede Hurlingham,Hurlingham,ARG,Buenos Aires,Universidad Nacional de Lomas de Zamora,4109,-34.6160779,-58.6365805
Alem 1253 - Bahia Blanca - Buenos Aires ,Departamento de Ingeniería,Bahía Blanca,ARG,Buenos Aires,Universidad Nacional del Sur,1381,-38.7017258,-62.2708281
Alem 1253 - Bahia Blanca - Buenos Aires ,Departamento de Ingeniería Química,Bahía Blanca,ARG,Buenos Aires,Universidad Nacional del Sur,1381,-38.7017258,-62.2708281
Av. Juan B. Justo 4302 - Mar Del Plata - Buenos Aires ,Facultad de Ingeniería,General Pueyrredón,ARG,Buenos Aires,Universidad Nacional de Mar del Plata,4120,-38.01157,-57.58097
JUAN M. DE ROSAS 325 - Obera - Misiones ,Facultad de Ingeniería,Oberá,ARG,Misiones,Universidad Nacional de Misiones,4123,-27.4852798,-55.1109551
Einstein y Salk 900 - Allen - Río Negro ,Allen - Sede Alto Valle-Valle Medio,General Roca,ARG,Rio Negro,Universidad Nacional de Río Negro,4133,-38.97605,-67.82962
Avenida Bolivia 5150 - Salta - Salta ,Facultad de Ingeniería,Salta,ARG,Salta,Universidad Nacional de Salta,1400,-24.76073,-65.4148699
Alsina 975 - San Andres De Giles - Buenos Aires ,Extensión aúlica San Andrés de Giles,San Andrés de Giles,ARG,Buenos Aires,Universidad Nacional de San Antonio de Areco,4143,-34.4471371,-59.4424788
Avenida Roca 1900 - San Miguel De Tucuman - Tucumán ,Facultad de Agronomía y Zootecnia - Concepción,San Miguel de Tucumán,ARG,Tucuman,Universidad Nacional de Tucumán,4161,-26.80773,-65.25292
Hipólito Yrigoyen 299 - Casbas - Buenos Aires ,Subsede Académica Casbas,Guaminí,ARG,Buenos Aires,Universidad Provincial del Sudoeste,4165,-36.759951,-62.5045126
11 de abril 461 - Bahia Blanca - Buenos Aires ,Facultad Regional Bahía Blanca,Bahía Blanca,ARG,Buenos Aires,Universidad Tecnológica Nacional,4168,-38.7102019,-62.2646498
Avda. del trabajo 1536 - Puerto Madryn - Chubut ,Facultad Regional Chubut,Biedma,ARG,Chubut,Universidad Tecnológica Nacional,4171,-42.75906,-65.05776
Ing. Pereyra 676 - Concepcion Del Uruguay - Entre Ríos ,Facultad Regional Concepción del Uruguay,Uruguay,ARG,Entre Rios,Universidad Tecnológica Nacional,4172,-32.4961564,-58.2295699
Calle 60 esq. 124 S/N - La Plata - Buenos Aires ,Facultad Regional La Plata,La Plata,ARG,Buenos Aires,Universidad Tecnológica Nacional,4190,-34.9047511,-57.9281661
San Nicolás de Bari (E) 1100 - La Rioja - La Rioja ,Facultad Regional La Rioja,La Rioja,ARG,La Rioja,Universidad Tecnológica Nacional,4191,-29.4104816,-66.8319528
Islas Malvinas 1650 - Rio Grande - Tierra Del Fuego ,Facultad Regional Rio Grande,Río Grande,ARG,Tierra Del Fuego,Universidad Tecnológica Nacional,2106,-53.7871909,-67.7245409
Laprida 651 - Venado Tuerto - Santa Fé ,Facultad Regional Venado Tuerto,General López,ARG,Santa Fe,Universidad Tecnológica Nacional,2555,-33.7410699,-61.9490948
Av.Eduardo Madero 399 - Ciudad Autonoma de Buenos Aires - Ciudad Autonoma de Buenos Aires ,Departamento de Informática,Ciudad de Buenos Aires,ARG,Ciudad Autonoma De Buenos Aires,Instituto Tecnológico de Buenos Aires,4224,-34.60315,-58.36813
Av.Fuerza Aérea 6500 - Córdoba - Córdoba ,Facultad de Ingeniería,Córdoba,ARG,Cordoba,Instituto Universitario Aeronáutico,1934,-31.4342343,-64.2713074
Las Heras 2191 - Ciudad Autonoma de Buenos Aires - Ciudad Autonoma de Buenos Aires ,Facultad de Medicina,Ciudad de Buenos Aires,ARG,Ciudad Autonoma De Buenos Aires,Instituto Universitario de Ciencias de la Salud de la Fundación Barceló,4230,-34.588505,-58.397719
Chacabuco 90 - Ciudad Autonoma de Buenos Aires - Ciudad Autonoma de Buenos Aires ,Facultad de Tecnología Informática,Ciudad de Buenos Aires,ARG,Ciudad Autonoma De Buenos Aires,Universidad Abierta Interamericana,2,-34.60908,-58.37636
Av. Pellegrini 1816 - Rosario - Santa Fé ,Facultad de Tecnología Informática - Rosario,Rosario,ARG,Santa Fe,Universidad Abierta Interamericana,450,-33.0316896,-60.6372831
Bartolomé Mitre 1411 - Ciudad Autonoma de Buenos Aires - Ciudad Autonoma de Buenos Aires ,Escuela de Sistemas,Ciudad de Buenos Aires,ARG,Ciudad Autonoma De Buenos Aires,Universidad Argentina John F. Kennedy,30,-34.60765,-58.3865
Av. de Mayo 866 - Ciudad Autonoma de Buenos Aires - Ciudad Autonoma de Buenos Aires ,Departamento de Sistemas,Ciudad de Buenos Aires,ARG,Ciudad Autonoma De Buenos Aires,Universidad CAECE,1279,-34.60889,-58.37873
9 de Julio 22 - Chilecito - La Rioja ,Escuela de Tecnología de la Información y las Comunicaciones,Chilecito,ARG,La Rioja,Universidad Nacional de Chilecito,206,-29.17235,-67.49761
Juan María Gutierrez 1150 1150 - Los Polvorines - Buenos Aires ,Instituto de Ciencias,Malvinas Argentinas,ARG,Buenos Aires,Universidad Nacional de General Sarmiento,4364,-34.5208625,-58.7003265
Boulevard Almirante Brown 3700 - Puerto Madryn - Chubut ,Facultad de Ingeniería - Sede Puerto Madryn,Biedma,ARG,Chubut,Universidad Nacional de la Patagonia San Juan Bosco,1348,-42.78313,-65.01475
Belgrano 504 - Trelew - Chubut ,Facultad de Ingeniería - Sede Trelew,Rawson,ARG,Chubut,Universidad Nacional de la Patagonia San Juan Bosco,1349,-43.2541888,-65.30636
calle 50 esq 120 - - La Plata - Buenos Aires ,Facultad de Informática,La Plata,ARG,Buenos Aires,Universidad Nacional de La Plata,4392,-34.9059812,-57.9400074
Calle 47 y 1 / Calle 50 y 120 - - La Plata - Buenos Aires ,Facultad de Informática e Ingeniería,La Plata,ARG,Buenos Aires,Universidad Nacional de La Plata,4395,-34.8994748,-57.9384664
Buenos Aires 1400 - Neuquen - Neuquén ,Facultad de Informática,Confluencia,ARG,Neuquen,Universidad Nacional del Comahue,328,-38.9415102,-68.0575008
Av. Las Heras 727 - Resistencia - Chaco ,Facultad de Ingeniería,San Fernando,ARG,Chaco,Universidad Nacional del Nordeste,342,-27.4632179,-58.9857119
Av. 3 de febrero 401 - Rojas - Buenos Aires ,Centro Universitario Rojas,Rojas,ARG,Buenos Aires,Universidad Nacional del Noroeste de la Provincia de Buenos Aires,4420,-34.2010132,-60.7275516
Córdoba 1055 - Merlo - Buenos Aires ,Escuela de informática,Merlo,ARG,Buenos Aires,Universidad Nacional del Oeste,4426,-34.6644588,-58.7338929
Avenida Alem 1253 - Bahia Blanca - Buenos Aires ,Departamento de Ciencias e Ingeniería de la Computación,Bahía Blanca,ARG,Buenos Aires,Universidad Nacional del Sur,1089,-38.7017258,-62.2708281
Las Heras 383 - Villa Mercedes - San Luis ,Escuela de Ingenieria,General Pedernera,ARG,San Luis,Universidad Nacional de Villa Mercedes,1418,-33.6851595,-65.4694484
Alfonsina Storni 41 - Ezeiza - Buenos Aires ,Departamento de Desarrollo Tecnológico,Ezeiza,ARG,Buenos Aires,Universidad Provincial de Ezeiza,432,-34.7892088,-58.5254058
Av. Pedro Rotter s/n - Plaza Huincul - Neuquén ,Facultad Regional del Neuquén,Confluencia,ARG,Neuquen,Universidad Tecnológica Nacional,4511,-38.92279,-69.1854199
Av. Eduardo Madero 399 - Ciudad Autonoma de Buenos Aires - Ciudad Autonoma de Buenos Aires ,BIOINGENIERIA,Ciudad de Buenos Aires,ARG,Ciudad Autonoma De Buenos Aires,Instituto Tecnológico de Buenos Aires,2258,-34.60315,-58.36813
Av.Eduardo Madero 399 - Ciudad Autonoma de Buenos Aires - Ciudad Autonoma de Buenos Aires ,Departamento de Electrónica,Ciudad de Buenos Aires,ARG,Ciudad Autonoma De Buenos Aires,Instituto Tecnológico de Buenos Aires,4224,-34.60315,-58.36813
Av. Eduardo Madero 399 - Ciudad Autonoma de Buenos Aires - Ciudad Autonoma de Buenos Aires ,Departamento de Ingeniería Eléctrica,Ciudad de Buenos Aires,ARG,Ciudad Autonoma De Buenos Aires,Instituto Tecnológico de Buenos Aires,2258,-34.60315,-58.36813
Av.Eduardo Madero 399 - Ciudad Autonoma de Buenos Aires - Ciudad Autonoma de Buenos Aires ,Departamento de Mecánica Naval,Ciudad de Buenos Aires,ARG,Ciudad Autonoma De Buenos Aires,Instituto Tecnológico de Buenos Aires,4224,-34.60315,-58.36813
Av.Eduardo Madero 399 - Ciudad Autonoma de Buenos Aires - Ciudad Autonoma de Buenos Aires ,Departamento de Petróleo,Ciudad de Buenos Aires,ARG,Ciudad Autonoma De Buenos Aires,Instituto Tecnológico de Buenos Aires,4224,-34.60315,-58.36813
Av. Eduardo Madero 399 - Ciudad Autonoma de Buenos Aires - Ciudad Autonoma de Buenos Aires ,Departamento de Química,Ciudad de Buenos Aires,ARG,Ciudad Autonoma De Buenos Aires,Instituto Tecnológico de Buenos Aires,2258,-34.60315,-58.36813
Avenida de Acceso Este 2245 - San Jose (Dpto. Guaymallen) - Mendoza ,Facultad de Ingeniería,Guaymallén,ARG,Mendoza,Universidad Juan Agustín Maza,900,-32.89729,-68.8119967
Av.12 de Julio y Rahue sn - Zapala - Neuquén ,Asentamiento Universitario Zapala,Zapala,ARG,Neuquen,Universidad Nacional del Comahue,4720,-38.89566,-70.07695
Belgrano 98 - Barrancas - Neuquén ,Módulo Chos Malal - Facultad de Ingeniería,Pehuenches,ARG,Neuquen,Universidad Nacional del Comahue,4728,-36.82031,-69.91521
Córdoba 1055 - Merlo - Buenos Aires ,Escuela de Ingeniería,Merlo,ARG,Buenos Aires,Universidad Nacional del Oeste,4426,-34.6644588,-58.7338929
Ruta 36 Km. 601 - Rio Cuarto - Córdoba ,Facultad de Ingeniería,Río Cuarto,ARG,Cordoba,Universidad Nacional de Río Cuarto,1584,-32.4586709,-64.3862245
Moreno 265 - Cinco Saltos - Río Negro ,Cinco Saltos - Sede Alto Valle-Valle Medio,General Roca,ARG,Rio Negro,Universidad Nacional de Río Negro,4781,-38.8266599,-68.06622
Azcuénaga 1129 - Ciudad Autonoma de Buenos Aires - Ciudad Autonoma de Buenos Aires ,Rectorado,Ciudad de Buenos Aires,ARG,Ciudad Autonoma De Buenos Aires,Instituto Universitario Nacional del Arte,5003,-34.59483,-58.39979
Zabala 1837 - Ciudad Autonoma de Buenos Aires - Ciudad Autonoma de Buenos Aires ,Facultad de Humanidades - Escuela de Lenguas y Estudios Extranjeros,Ciudad de Buenos Aires,ARG,Ciudad Autonoma De Buenos Aires,Universidad de Belgrano,110,-34.5645538,-58.4441269
Lavalle 393 - Mendoza - Mendoza ,Escuela Superior de Lenguas Extranjeras,Mendoza,ARG,Mendoza,Universidad del Aconcagua,5063,-32.8887194,-68.8329771
Av. Corrientes 1723 - Ciudad Autonoma de Buenos Aires - Ciudad Autonoma de Buenos Aires ,Facultad de Lenguas Modernas,Ciudad de Buenos Aires,ARG,Ciudad Autonoma De Buenos Aires,Universidad del Museo Social Argentino,1741,-34.6044,-58.39129
Lavalle 1878 - Ciudad Autonoma de Buenos Aires - Ciudad Autonoma de Buenos Aires ,Escuela de Lenguas Modernas,Ciudad de Buenos Aires,ARG,Ciudad Autonoma De Buenos Aires,Universidad del Salvador,3420,-34.60319,-58.39354
Avda. Valparaiso - Cd.Universitaria S/N - Córdoba - Córdoba ,Facultad de Lenguas,Córdoba,ARG,Cordoba,Universidad Nacional de Córdoba,5108,-31.43697,-64.18558
Mendoza 2151 - Gral. Roca - Río Negro ,Facultad de Lenguas,General Roca,ARG,Rio Negro,Universidad Nacional del Comahue,5172,-37.87943,-67.7950199
Av. de Mayo 866 - Ciudad Autonoma de Buenos Aires - Ciudad Autonoma de Buenos Aires ,Departamento de Matemáticas,Ciudad de Buenos Aires,ARG,Ciudad Autonoma De Buenos Aires,Universidad CAECE,1279,-34.60889,-58.37873
Avenida Alem 1253 - Bahia Blanca - Buenos Aires ,Departamento de Matemática,Bahía Blanca,ARG,Buenos Aires,Universidad Nacional del Sur,1089,-38.7017258,-62.2708281
Av. E. Galván 4102 - Ciudad Autonoma de Buenos Aires - Ciudad Autonoma de Buenos Aires ,Unidad Académica Escuela de Medicina,Ciudad de Buenos Aires,ARG,Ciudad Autonoma De Buenos Aires,Instituto Universitario CEMIC,5303,-34.5565348,-58.4952275
Friuli 2786. B° Parque Vélez Sarsfield - - Córdoba - Córdoba ,Medicina,Córdoba,ARG,Cordoba,Instituto Universitario de Ciencias Biomédicas de Córdoba,5304,-31.4436794,-64.1986895
Crespo 843 - Rosario - Santa Fé ,Escuela de Medicina,Rosario,ARG,Santa Fe,Instituto Universitario Italiano de Rosario,5307,-32.9415702,-60.6683824
Av. Alicia Moreau de Justo 1600 - Ciudad Autonoma de Buenos Aires - Ciudad Autonoma de Buenos Aires ,Facultad de Ciencias Médicas,Ciudad de Buenos Aires,ARG,Ciudad Autonoma De Buenos Aires,Pontificia Universidad Católica Argentina Santa María de los Buenos Aires,5308,-34.617,-58.36585
Chacabuco 90 - Ciudad Autonoma de Buenos Aires - Ciudad Autonoma de Buenos Aires ,Facultad de Medicina y Ciencias de la Salud,Ciudad de Buenos Aires,ARG,Ciudad Autonoma De Buenos Aires,Universidad Abierta Interamericana,2,-34.60908,-58.37636
Av. Pellegrini 1816 - Rosario - Santa Fé ,Facultad de Medicina y Ciencias de la Salud - Rosario,Rosario,ARG,Santa Fe,Universidad Abierta Interamericana,450,-33.0316896,-60.6372831
25 de Mayo 99 - Libertador General San Martín - Entre Ríos ,Facultad de Ciencias de la Salud,Diamante,ARG,Entre Rios,Universidad Adventista del Plata,1641,-32.0760348,-60.464128
Juan Domingo Perón 1500 -ex - Pilar - Buenos Aires ,Facultad de Ciencias Biomédicas,Pilar,ARG,Buenos Aires,Universidad Austral,5312,-34.4556288,-58.772465
