Domicilio,Facultad,Municipio,Pais,Provincia,Universidad,index,lat,lng
Av Cabildo 15 - Ciudad Autonoma de Buenos Aires - Ciudad Autonoma de Buenos Aires ,Unidad Académica Escuela Superior Técnica,Ciudad de Buenos Aires,ARG,Ciudad Autonoma De Buenos Aires,"Instituto Universitario del Ejército ""Mayor Francisco Romero""",0,-34.57476,-58.43563
Chacabuco 90 - Ciudad Autonoma de Buenos Aires - Ciudad Autonoma de Buenos Aires ,Facultad de Turismo y Hospitalidad,Ciudad de Buenos Aires,ARG,Ciudad Autonoma De Buenos Aires,Universidad Abierta Interamericana,2,-34.60908,-58.37636
Av.Pellegrini 1816 - Rosario - Santa Fé ,Facultad de Turismo y Hospitalidad - Rosario,Rosario,ARG,Santa Fe,Universidad Abierta Interamericana,12,-33.0316896,-60.6372831
Lima 717 - Ciudad Autonoma de Buenos Aires - Ciudad Autonoma de Buenos Aires ,Facultad de Comunicación,Ciudad de Buenos Aires,ARG,Ciudad Autonoma De Buenos Aires,Universidad Argentina de la Empresa,22,-34.617,-58.38156
Lima 717 - Ciudad Autonoma de Buenos Aires - Ciudad Autonoma de Buenos Aires ,Facultad de Comunicación y Diseño,Ciudad de Buenos Aires,ARG,Ciudad Autonoma De Buenos Aires,Universidad Argentina de la Empresa,22,-34.617,-58.38156
Bartolomé Mitre 1411 - Ciudad Autonoma de Buenos Aires - Ciudad Autonoma de Buenos Aires ,Facultad de Ciencias Económicas y Empresariales,Ciudad de Buenos Aires,ARG,Ciudad Autonoma De Buenos Aires,Universidad Argentina John F. Kennedy,30,-34.60765,-58.3865
ARENALES 2740 - Mar Del Plata - Buenos Aires ,ANEXO MAR DEL PLATA,General Pueyrredón,ARG,Buenos Aires,Universidad Atlántida Argentina,38,-38.01137,-57.54667
DIAG. RIVADAVIA 515 - Mar De Ajo - Buenos Aires ,UNIVERSIDAD ATLANTIDA ARGENTINA SEDE CENTRAL,La Costa,ARG,Buenos Aires,Universidad Atlántida Argentina,42,-36.72667,-56.67957
25 de Mayo 497 - Gualeguaychu - Entre Ríos ,Facultad de Ciencias de la Gestión. Sede Gualeguaychú,Gualeguaychú,ARG,Entre Rios,Universidad Autónoma de Entre Ríos,48,-33.0093096,-58.5098209
Urquiza 1225 - Paraná - Entre Ríos ,Facultad de Ciencias de la Gestión. Sede Paraná,Paraná,ARG,Entre Rios,Universidad Autónoma de Entre Ríos,50,-31.8088,-59.94393
Leguizamon 24 - Concepcion Del Uruguay - Entre Ríos ,Facultad de Ciencias de la Gestión. Sede Uruguay,Uruguay,ARG,Entre Rios,Universidad Autónoma de Entre Ríos,54,-32.4845907,-58.2338652
Mitre 22 - Villaguay - Entre Ríos ,Facultad de Ciencias de la Gestión. Sede Villaguay,Villaguay,ARG,Entre Rios,Universidad Autónoma de Entre Ríos,58,-31.98548,-58.96034
Justo José de Urquiza 900 - Paraná - Entre Ríos ,"Facultad de Humanidades, Artes y Ciencias Sociales. Sede Paraná",Paraná,ARG,Entre Rios,Universidad Autónoma de Entre Ríos,60,-31.9545033,-60.12484
Jordana 50 - Concepcion Del Uruguay - Entre Ríos ,"Facultad de Humanidades, Artes y Ciencias Sociales. Sede Uruguay",Uruguay,ARG,Entre Rios,Universidad Autónoma de Entre Ríos,64,-32.4845698,-58.2286501
Av. Donato Álvarez 380 - Córdoba - Córdoba ,Vicerrectorado de Asuntos Académicos,Córdoba,ARG,Cordoba,Universidad Blas Pascal,68,-31.30833,-64.28034
Olavarría 2464 - Mar Del Plata - Buenos Aires ,Departamento de Administración y Ciencias Sociales - Sede Mar del Plata,General Pueyrredón,ARG,Buenos Aires,Universidad CAECE,74,-38.0116618,-57.5398622
Avda. José Ignacio de la Roza 1516 - San Juan - San Juan ,Facultad de Ciencias Económicas y Empresariales,San Juan,ARG,San Juan,Universidad Católica de Cuyo,76,-31.5376072,-68.5885474
Avda. José Ignacio de la Roza 1516 (o) - San Juan - San Juan ,Facultad de Ciencias Químicas y Tecnológicas,San Juan,ARG,San Juan,Universidad Católica de Cuyo,78,-31.5376072,-68.5885474
Ruta Pcial 50 6722 - Maipu - Mendoza ,Facultad Don Bosco de Enología y Ciencias de la Alimentación - Sede Rodeo del Medio,Mendoza,ARG,Mendoza,Universidad Católica de Cuyo,80,-32.876335,-68.8350653
25 e/47 y 48 S/N - La Plata - Buenos Aires ,Facultad de Ciencias Económicas y Sociales,La Plata,ARG,Buenos Aires,Universidad Católica de La Plata,82,-34.8995323,-57.9385431
11 e/ 51 y 53 972 - La Plata - Buenos Aires ,Facultad de Humanidades,La Plata,ARG,Buenos Aires,Universidad Católica de La Plata,86,-34.95993,-57.81343
Campo Castañares s/n S/N - Salta - Salta ,Escuela Universitaria de Turismo,Salta,ARG,Salta,Universidad Católica de Salta,88,-65.3940388,-24.7399601
Campo Castañares s/n - Salta - Salta ,Escuela Universitaria de Turismo - Sistema de Educación a Distancia,Salta,ARG,Salta,Universidad Católica de Salta,94,-65.3940388,-24.7399601
Eschagüe 7151 - Santa Fe - Santa Fé ,Facultad de Humanidades,Santa Fe,ARG,Santa Fe,Universidad Católica de Santa Fe,96,-31.5738299,-60.7438701
Corrientes 180 - Olivos - Buenos Aires ,Departamento Académico Buenos Aires,Vicente López,ARG,Buenos Aires,Universidad Católica de Santiago del Estero,98,-34.5071798,-58.4769836
Boulevard Hipólito Irigoyen 1502 - Rafaela - Santa Fé ,Departamento Académico Rafaela,Castellanos,ARG,Santa Fe,Universidad Católica de Santiago del Estero,100,-31.2667752,-61.4949956
Lavalle 333 - San Salvador De Jujuy - Jujuy ,Departamento Académico San Salvador,Dr Manuel Belgrano,ARG,Jujuy,Universidad Católica de Santiago del Estero,102,-24.1848793,-65.3028624
Av. Alsina Y Dalmacio Vélez Sarsfield s/n - Santiago Del Estero - Santiago Del Estero ,Facultad de Ciencias Económicas,Santiago del Estero,ARG,Santiago Del Estero,Universidad Católica de Santiago del Estero,104,-27.79951,-64.23934
Av. Alsina Y Dalmacio Vélez Sarsfield s/n - Santiago Del Estero - Santiago Del Estero ,"Facultad de Ciencias Políticas, Sociales y Jurídicas",Santiago del Estero,ARG,Santiago Del Estero,Universidad Católica de Santiago del Estero,104,-27.79951,-64.23934
Zabala 1837 - Ciudad Autonoma de Buenos Aires - Ciudad Autonoma de Buenos Aires ,Facultad de Ciencias Económicas,Ciudad de Buenos Aires,ARG,Ciudad Autonoma De Buenos Aires,Universidad de Belgrano,110,-34.5645538,-58.4441269
Av. Federico Lacroze 1955 - Ciudad Autonoma de Buenos Aires - Ciudad Autonoma de Buenos Aires ,Facultad de Estudios a Distancia y Educación Virtual,Ciudad de Buenos Aires,ARG,Ciudad Autonoma De Buenos Aires,Universidad de Belgrano,112,-34.56598,-58.44103
Zabala 1837 - Ciudad Autonoma de Buenos Aires - Ciudad Autonoma de Buenos Aires ,Facultad de Humanidades,Ciudad de Buenos Aires,ARG,Ciudad Autonoma De Buenos Aires,Universidad de Belgrano,110,-34.5645538,-58.4441269
Av. San Martín 4453 - Ciudad Autonoma de Buenos Aires - Ciudad Autonoma de Buenos Aires ,Facultad de Agronomía,Ciudad de Buenos Aires,ARG,Ciudad Autonoma De Buenos Aires,Universidad de Buenos Aires,118,-34.59807,-58.48238
Puán 480 - Ciudad Autonoma de Buenos Aires - Ciudad Autonoma de Buenos Aires ,Facultad de Filosofía y Letras,Ciudad de Buenos Aires,ARG,Ciudad Autonoma De Buenos Aires,Universidad de Buenos Aires,120,-34.62831,-58.4467
Paraguay 1401 - Ciudad Autonoma de Buenos Aires - Ciudad Autonoma de Buenos Aires ,Facultad de Ciencias Empresariales,Ciudad de Buenos Aires,ARG,Ciudad Autonoma De Buenos Aires,Universidad de Ciencias Empresariales y Sociales,124,-34.5983,-58.38711
Av. Colón 90 - Mendoza - Mendoza ,Facultad Universidad de Congreso,Mendoza,ARG,Mendoza,Universidad de Congreso,126,-32.8947875,-68.8415264
Catamarca 147 - Mendoza - Mendoza ,Facultad de Ciencias Sociales y Administrativas,Mendoza,ARG,Mendoza,Universidad del Aconcagua,134,-32.8897488,-68.8362971
Catamarca 147 - Mendoza - Mendoza ,Rectorado,Mendoza,ARG,Mendoza,Universidad del Aconcagua,134,-32.8897488,-68.8362971
Av Cabildo 65 - Ciudad Autonoma de Buenos Aires - Ciudad Autonoma de Buenos Aires ,Facultad del Ejército,Ciudad de Buenos Aires,ARG,Ciudad Autonoma De Buenos Aires,Universidad de la Defensa Nacional,140,-34.57426,-58.43662
Gascón 3145 - Mar Del Plata - Buenos Aires ,Facultad de Ciencias Económicas,General Pueyrredón,ARG,Buenos Aires,Universidad de la Fraternidad de Agrupaciones Santo Tomás de Aquino,142,-38.0031139,-57.5575811
Av. Rivadavia 2258 - Ciudad Autonoma de Buenos Aires - Ciudad Autonoma de Buenos Aires ,"Facultad de Ciencias Jurídicas, Sociales y de la Comunicación",Ciudad de Buenos Aires,ARG,Ciudad Autonoma De Buenos Aires,Universidad de la Marina Mercante,144,-34.60968,-58.39841
9 de Julio 165 - San Miguel De Tucuman - Tucumán ,Facultad de Economía y Administración,San Miguel de Tucumán,ARG,Tucuman,Universidad del Norte Santo Tomás de Aquino,146,-26.82355,-65.26626
Champagnat 1599 - Pilar - Buenos Aires ,Complejo Educativo Nuestra Señora del Pilar,Pilar,ARG,Buenos Aires,Universidad del Salvador,150,-34.4391635,-58.9258488
Viamonte 2213 - Ciudad Autonoma de Buenos Aires - Ciudad Autonoma de Buenos Aires ,"Facultad de Historia, Geografía y Turismo",Ciudad de Buenos Aires,ARG,Ciudad Autonoma De Buenos Aires,Universidad del Salvador,154,-34.60109,-58.39894
Machado 854 - Moron - Buenos Aires ,Facultad de Ciencias Aplicadas al Turismo y la Población,Morón,ARG,Buenos Aires,Universidad de Morón,162,-34.6464148,-58.6204543
Larrea 1079 - Ciudad Autonoma de Buenos Aires - Ciudad Autonoma de Buenos Aires ,Facultad de Ciencias Económicas,Ciudad de Buenos Aires,ARG,Ciudad Autonoma De Buenos Aires,Universidad de Palermo,170,-34.5951,-58.40122
Calle de los Latinos 8555 - Córdoba - Córdoba ,Grado,Córdoba,ARG,Cordoba,Universidad Empresarial Siglo 21,176,-31.33831,-64.21627
Salta 1968 - Posadas - Misiones ,Departamento de Ciencias Económicas y Empresariales,Posadas,ARG,Misiones,Universidad Gastón Dachary,184,-27.3714972,-55.8959452
Av de Acceso Este 2245 - San Jose (Dpto. Guaymallen) - Mendoza ,Facultad de Enología y Agroindustrias,Guaymallén,ARG,Mendoza,Universidad Juan Agustín Maza,186,-32.89729,-68.8119967
Hidalgo 775 - Ciudad Autonoma de Buenos Aires - Ciudad Autonoma de Buenos Aires ,"Facultad de Humanidades, Ciencias Sociales y Empresariales",Ciudad de Buenos Aires,ARG,Ciudad Autonoma De Buenos Aires,Universidad Maimónides,188,-34.61049,-58.44105
Sarmiento 2037 - Ciudad Autonoma de Buenos Aires - Ciudad Autonoma de Buenos Aires ,"FACULTAD DE TURISMO, EDUCACIÓN FÍSICA Y DEPORTES",Ciudad de Buenos Aires,ARG,Ciudad Autonoma De Buenos Aires,Universidad Metropolitana para la Educación y el Trabajo,192,-34.6059,-58.39574
España 350 - Avellaneda - Buenos Aires ,Departamento de Ambiente y Turismo,Avellaneda,ARG,Buenos Aires,Universidad Nacional de Avellaneda,194,-34.6628049,-58.3722248
Avenida Belgrano 300 - San Fernando del Valle de Catamarca - Catamarca ,Facultad de Humanidades,San Fernando del Valle de Catamarca,ARG,Catamarca,Universidad Nacional de Catamarca,200,-28.4606102,-65.7832716
9 de Julio 22 - Chilecito - La Rioja ,Escuela de Ciencias Agrarias,Chilecito,ARG,La Rioja,Universidad Nacional de Chilecito,206,-29.17235,-67.49761
9 de Julio 22 - Chilecito - La Rioja ,Escuela de Desarrollo Local,Chilecito,ARG,La Rioja,Universidad Nacional de Chilecito,206,-29.17235,-67.49761
Av. Valparaíso - Cd. Universitaria S/N - Córdoba - Córdoba ,Facultad de Ciencias de la Comunicación,Córdoba,ARG,Cordoba,Universidad Nacional de Córdoba,214,-31.43697,-64.18558
Pabellón Residencial - C. Universitaria . - Córdoba - Córdoba ,Facultad de Filosofía y Humanidades,Córdoba,ARG,Cordoba,Universidad Nacional de Córdoba,216,-31.40598,-64.20536
Centro Univ. - Parque Gral. San Martín Sin nro. - Mendoza - Mendoza ,Facultad de Filosofía y Letras,Mendoza,ARG,Mendoza,Universidad Nacional de Cuyo,218,-32.88299,-68.876431
Campus Universitario Múltiple-Alem y 25 630 - San Martin - Mendoza ,Facultad de Filosofía y Letras - Delegación Zona Este,San Martín,ARG,Mendoza,Universidad Nacional de Cuyo,226,-33.06729,-68.46847
Monseñor Tavella 1424 - Concordia - Entre Ríos ,Facultad de Ciencias de la Administración,Concordia,ARG,Entre Rios,Universidad Nacional de Entre Ríos,228,-31.3819795,-58.0221716
Avenida Gobernador Gutnisky 3200 - Formosa - Formosa ,Facultad de Humanidades,Formosa,ARG,Formosa,Universidad Nacional de Formosa,230,-26.1292902,-58.1494648
Avda. San Martín y Rivadavia s/n - Laguna Blanca - Formosa ,Facultad de la Producción y Medio Ambiente,Pilcomayo,ARG,Formosa,Universidad Nacional de Formosa,234,-25.13376,-58.2433
Juan María Gutierrez 1150 - Los Polvorines - Buenos Aires ,Instituto del Conurbano,Malvinas Argentinas,ARG,Buenos Aires,Universidad Nacional de General Sarmiento,236,-34.5208625,-58.7003265
29 de Septiembre 3901 - Remedios de Escalada - Buenos Aires ,Departamento de Desarrollo Productivo y Tecnológico,Lanús,ARG,Buenos Aires,Universidad Nacional de Lanús,238,-34.7342286,-58.3901502
C.Gil 353 - Santa Rosa - La Pampa ,Facultad de Ciencias Humanas,Santa Rosa,ARG,La Pampa,Universidad Nacional de La Pampa,244,-36.6205311,-64.28991
RUTA NACIONAL 3 - ACC. NORTE 9011 - Caleta Olivia - Santa Cruz ,UNIDAD ACADEMICA CALETA OLIVIA,Deseado,ARG,Santa Cruz,Universidad Nacional de la Patagonia Austral,252,-46.44555,-67.5103199
COLON esq. SARMIENTO - Bº 200 VIV. s/n - Puerto San Julian - Santa Cruz ,UNIDAD ACADEMICA PUERTO SAN JULIAN,Magallanes,ARG,Santa Cruz,Universidad Nacional de la Patagonia Austral,260,-49.3139284,-67.7187486
LISANDRO DE LA TORRE 1070 - Rio Gallegos - Santa Cruz ,UNIDAD ACADEMICA RIO GALLEGOS,Güer Aike,ARG,Santa Cruz,Universidad Nacional de la Patagonia Austral,268,-51.6221036,-69.2551571
AV. DE LOS MINEROS 1260 - El Turbio - Santa Cruz ,UNIDAD ACADEMICA RIO TURBIO,Güer Aike,ARG,Santa Cruz,Universidad Nacional de la Patagonia Austral,280,-51.67383,-72.0982499
Ruta Provincial Nº 1 - Km4 sd - Comodoro Rivadavia - Chubut ,Facultad de Humanidades y Ciencias Sociales - Sede Comodoro Rivadavia,Escalante,ARG,Chubut,Universidad Nacional de la Patagonia San Juan Bosco,288,-45.8657412,-67.5026264
Rw Gales y Belgrano sn - Trelew - Chubut ,Facultad de Humanidades y Ciencias Sociales - Sede Trelew,Rawson,ARG,Chubut,Universidad Nacional de la Patagonia San Juan Bosco,294,-43.2524,-65.3179
Boul.Almirante Brown 3051 - Puerto Madryn - Chubut ,Facultad Humanidades y Ciencias Sociales - Sede Puerto Madryn,Biedma,ARG,Chubut,Universidad Nacional de la Patagonia San Juan Bosco,296,-42.7852951,-65.0061527
6 Nro 777 - La Plata - Buenos Aires ,Facultad de Ciencias Económicas,La Plata,ARG,Buenos Aires,Universidad Nacional de La Plata,298,-35.0474,-58.13752
48 e/ 6 y 7 s/n - La Plata - Buenos Aires ,Facultad de Humanidades y Ciencias de la Educación,La Plata,ARG,Buenos Aires,Universidad Nacional de La Plata,300,-34.9003139,-57.9668758
Av. Lavalle S/Nº - Villa Union - La Rioja ,Sede Villa Unión,La Rioja,ARG,La Rioja,Universidad Nacional de La Rioja,308,-29.41208,-66.82413
Arroyo Seco SN - Tandil - Buenos Aires ,Facultad de Ciencias Humanas,Tandil,ARG,Buenos Aires,Universidad Nacional del Centro de la Provincia de Buenos Aires,310,-37.34123,-59.10922
Pasaje de la Paz 235 - San Martin De Los Andes - Neuquén ,Asentamiento Universitario San Martín de los Andes,Lácar,ARG,Neuquen,Universidad Nacional del Comahue,326,-40.1570655,-71.3595971
Buenos Aires 1400 - Neuquen - Neuquén ,Facultad de Humanidades,Confluencia,ARG,Neuquen,Universidad Nacional del Comahue,328,-38.9415102,-68.0575008
Buenos Airres 1400 - Neuquen - Neuquén ,Facultad de Turismo,Confluencia,ARG,Neuquen,Universidad Nacional del Comahue,332,-38.9415102,-68.0575008
Arturo Illia 360 - Resistencia - Chaco ,"Facultad de Artes, Diseño y Ciencias de la Cultura - Sede Corrientes",San Fernando,ARG,Chaco,Universidad Nacional del Nordeste,338,-27.4554678,-58.9851102
Av. Las Heras 727 - Resistencia - Chaco ,Facultad de Humanidades,San Fernando,ARG,Chaco,Universidad Nacional del Nordeste,342,-27.4632179,-58.9857119
12 de octubre y San Juan - - Bahia Blanca - Buenos Aires ,Departamento de Geografía y Turismo,Bahía Blanca,ARG,Buenos Aires,Universidad Nacional del Sur,350,-38.7061599,-62.26391
San Juan 670 - Bahia Blanca - Buenos Aires ,Departamento de Geología,Bahía Blanca,ARG,Buenos Aires,Universidad Nacional del Sur,356,-38.7023215,-62.2693538
Farias 1590 - San Miguel - Buenos Aires ,Centro Regional San Miguel,San Miguel,ARG,Buenos Aires,Universidad Nacional de Luján,358,-34.5736024,-58.7456752
Funes (Complejo Universitario) 3250 - Mar Del Plata - Buenos Aires ,Facultad de Ciencias Económicas y Sociales,General Pueyrredón,ARG,Buenos Aires,Universidad Nacional de Mar del Plata,364,-38.025457,-57.6195293
Calle 54 3062 - Necochea - Buenos Aires ,Facultad de Ciencias Económicas y Sociales - Sede Necochea,Necochea,ARG,Buenos Aires,Universidad Nacional de Mar del Plata,368,-38.5573808,-58.7388114
Funes (Complejo Universitario) 3350 - Mar Del Plata - Buenos Aires ,Facultad de Humanidades,General Pueyrredón,ARG,Buenos Aires,Universidad Nacional de Mar del Plata,370,-38.0266709,-57.620948
Ruta 12 Km 7.5 - Posadas - Misiones ,Facultad de Ciencias Económicas,Posadas,ARG,Misiones,Universidad Nacional de Misiones,374,-27.40146,-55.9299
TUCUMAN 1946 - Posadas - Misiones ,Facultad de Humanidades y Ciencias Sociales,Posadas,ARG,Misiones,Universidad Nacional de Misiones,376,-27.3724348,-55.8959047
Roque Saenz Peña 352 - Bernal - Buenos Aires ,Departamento de Ciencias Sociales,Quilmes,ARG,Buenos Aires,Universidad Nacional de Quilmes,380,-34.70629,-58.27705
Roque Sáenz Peña 352 - Bernal - Buenos Aires ,Departamento de Economía y Administración,Quilmes,ARG,Buenos Aires,Universidad Nacional de Quilmes,382,-34.70629,-58.27705
Ruta 36 Km 601 - Rio Cuarto - Córdoba ,Facultad de Ciencias Humanas,Río Cuarto,ARG,Cordoba,Universidad Nacional de Río Cuarto,386,-32.4586709,-64.3862245
Mitre 630 - San Carlos De Bariloche - Río Negro ,Unidad Académica Sede Andina,Bariloche,ARG,Rio Negro,Universidad Nacional de Río Negro,390,-41.13346,-71.35978
Av. José I. de la Roza (Oeste) 230 - San Juan - San Juan ,"Facultad de Filosofía, Humanidades y Artes",San Juan,ARG,San Juan,Universidad Nacional de San Juan,398,-31.53748,-68.5288999
Pbro Becerra 540 - Merlo - San Luis ,Facultad de Turismo y Urbanismo,Junín,ARG,San Luis,Universidad Nacional de San Luis,408,-32.33345,-65.02658
Caseros 2253 - Barrio Gral. San Martin - Buenos Aires ,Escuela de Economía y Negocios - San Martín,Daireaux,ARG,Buenos Aires,Universidad Nacional de San Martín,414,-36.60568,-61.75566
Onas 450 - Ushuaia - Tierra Del Fuego ,Instituto de Desarrollo Económico e Innovación,Ushuaia,ARG,Tierra Del Fuego,"Universidad Nacional de Tierra del Fuego, Antártida e Islas del Atlántico Sur",416,-54.8072959,-68.3203366
Valentín Gómez 4828/38 - 3 De Febrero - Buenos Aires ,Secretaría Académica,3 de Febrero,ARG,Buenos Aires,Universidad Nacional de Tres de Febrero,420,-34.6049368,-58.564289
Av. Benjamin Araoz 800 - San Miguel De Tucuman - Tucumán ,Facultad de Filosofía y Letras,San Miguel de Tucumán,ARG,Tucuman,Universidad Nacional de Tucumán,428,-26.8346523,-65.1861108
Alfonsina Storni 41 - Ezeiza - Buenos Aires ,Departamento de Desarrollo Humano y Organizacional,Ezeiza,ARG,Buenos Aires,Universidad Provincial de Ezeiza,432,-34.7892088,-58.5254058
Lavalle 40 - Carmen de Patagones - Buenos Aires ,Sede Académica Carmen de Patagones,Patagones,ARG,Buenos Aires,Universidad Provincial del Sudoeste,436,-40.7950204,-62.9774721
Rodríguez 273 - Mendoza - Mendoza ,Facultad Regional Mendoza,Mendoza,ARG,Mendoza,Universidad Tecnológica Nacional,438,-32.8972239,-68.853692
Intendente Güiraldes 2160 - Ciudad Autonoma de Buenos Aires - Ciudad Autonoma de Buenos Aires ,Facultad de Ciencias Exactas y Naturales,Ciudad de Buenos Aires,ARG,Ciudad Autonoma De Buenos Aires,Universidad de Buenos Aires,442,-34.54684,-58.43995
Avenidad Belgrano 300 - San Fernando del Valle de Catamarca - Catamarca ,Escuela de Arqueología,San Fernando del Valle de Catamarca,ARG,Catamarca,Universidad Nacional de Catamarca,443,-28.4606102,-65.7832716
Miguel Lillo 209 - San Miguel De Tucuman - Tucumán ,Facultad de Ciencias Naturales e Instituto Miguel Lillo,San Miguel de Tucumán,ARG,Tucuman,Universidad Nacional de Tucumán,446,-26.83069,-65.2209
French 3614 - Ciudad Autonoma de Buenos Aires - Ciudad Autonoma de Buenos Aires ,Departamento de Artes Dramáticas Antonio Cunill Cabanellas,Ciudad de Buenos Aires,ARG,Ciudad Autonoma De Buenos Aires,Instituto Universitario Nacional del Arte,447,-34.58308,-58.41166
Chacabuco 90 - Ciudad Autonoma de Buenos Aires - Ciudad Autonoma de Buenos Aires ,Facultad de Arquitectura.,Ciudad de Buenos Aires,ARG,Ciudad Autonoma De Buenos Aires,Universidad Abierta Interamericana,2,-34.60908,-58.37636
Av. Pellegrini 1816 - Rosario - Santa Fé ,Facultad de Arquitectura - Rosario,Rosario,ARG,Santa Fe,Universidad Abierta Interamericana,450,-33.0316896,-60.6372831
Chacabuco 90 - Ciudad Autonoma de Buenos Aires - Ciudad Autonoma de Buenos Aires ,Facultad de Ciencias de la Comunicación,Ciudad de Buenos Aires,ARG,Ciudad Autonoma De Buenos Aires,Universidad Abierta Interamericana,2,-34.60908,-58.37636
Av. Pellegrini 1816 - Rosario - Santa Fé ,Facultad de Ciencias de la Comunicación - Rosario,Rosario,ARG,Santa Fe,Universidad Abierta Interamericana,450,-33.0316896,-60.6372831
Lima 717 - Ciudad Autonoma de Buenos Aires - Ciudad Autonoma de Buenos Aires ,Facultad de Arquitectura y Diseño,Ciudad de Buenos Aires,ARG,Ciudad Autonoma De Buenos Aires,Universidad Argentina de la Empresa,22,-34.617,-58.38156
Bme.Mitre 1411 - Ciudad Autonoma de Buenos Aires - Ciudad Autonoma de Buenos Aires ,Escuela de Arquitectura,Ciudad de Buenos Aires,ARG,Ciudad Autonoma De Buenos Aires,Universidad Argentina John F. Kennedy,476,-34.55028,-58.50033
Bartolomé Mitre 1411 - Ciudad Autonoma de Buenos Aires - Ciudad Autonoma de Buenos Aires ,"Facultad de Ciencias Sociales, Jurídicas y Humanas",Ciudad de Buenos Aires,ARG,Ciudad Autonoma De Buenos Aires,Universidad Argentina John F. Kennedy,30,-34.60765,-58.3865
Olavarría 2464 - Mar Del Plata - Buenos Aires ,Departamento de Sistemas - Sede Mar del Plata,General Pueyrredón,ARG,Buenos Aires,Universidad CAECE,74,-38.0116618,-57.5398622
Av. Armada Argentina 3555 - Córdoba - Córdoba ,Facultad de Arquitectura,Córdoba,ARG,Cordoba,Universidad Católica de Córdoba,482,-31.4858262,-64.2464424
50 818 - La Plata - Buenos Aires ,Facultad de Arquitectura y Diseño,La Plata,ARG,Buenos Aires,Universidad Católica de La Plata,483,-34.9189219,-57.9541807
25 de Mayo 51 - Bernal - Buenos Aires ,Unidad Académica Bernal - Facultad de Arquitectura y Diseño,Quilmes,ARG,Buenos Aires,Universidad Católica de La Plata,489,-34.71012,-58.28246
Campo Castañares s/n - Salta - Salta ,Facultad de Arquitectura y Urbanismo,Salta,ARG,Salta,Universidad Católica de Salta,94,-65.3940388,-24.7399601
Campo Castañares s/n - Salta - Salta ,Facultad de Artes y Ciencias,Salta,ARG,Salta,Universidad Católica de Salta,94,-65.3940388,-24.7399601
Echagüe 7151 - Santa Fe - Santa Fé ,Facultad de Arquitectura,Santa Fe,ARG,Santa Fe,Universidad Católica de Santa Fe,497,-31.6071348,-60.6708799
Rademacher 3943 - Posadas - Misiones ,Facultad de Arquitectura - Posadas,Posadas,ARG,Misiones,Universidad Católica de Santa Fe,501,-27.3860046,-55.8963764
Mendoza 4197 - Rosario - Santa Fé ,Facultad de Arquitectura - Rosario,Rosario,ARG,Santa Fe,Universidad Católica de Santa Fe,502,-32.943978,-60.6816
Av. Alsina Y Dalmacio Vélez Sarsfield S/N - Santiago Del Estero - Santiago Del Estero ,Facultad de Ciencias para la Innovación y el Desarrollo,Santiago del Estero,ARG,Santiago Del Estero,Universidad Católica de Santiago del Estero,510,-27.79951,-64.23934
Belgrano 721 - Godoy Cruz - Mendoza ,Facultad de Informática y Diseño,Godoy Cruz,ARG,Mendoza,Universidad Champagnat,512,-32.9175552,-68.8430566
Zabala 1837 - Ciudad Autonoma de Buenos Aires - Ciudad Autonoma de Buenos Aires ,Facultad de Arquitectura y Urbanismo,Ciudad de Buenos Aires,ARG,Ciudad Autonoma De Buenos Aires,Universidad de Belgrano,110,-34.5645538,-58.4441269
Federico Lacroze 1947 - Ciudad Autonoma de Buenos Aires - Ciudad Autonoma de Buenos Aires ,Facultad de Ingeniería Y Tecnología Informática,Ciudad de Buenos Aires,ARG,Ciudad Autonoma De Buenos Aires,Universidad de Belgrano,517,-34.5657843,-58.443185
Intendente Güiraldes 2160 - Ciudad Autonoma de Buenos Aires - Ciudad Autonoma de Buenos Aires ,Facultad de Arquitectura Diseño y Urbanismo,Ciudad de Buenos Aires,ARG,Ciudad Autonoma De Buenos Aires,Universidad de Buenos Aires,442,-34.54684,-58.43995
Paraguay 1401 - Ciudad Autonoma de Buenos Aires - Ciudad Autonoma de Buenos Aires ,Facultad de Ciencias de la Comunicación,Ciudad de Buenos Aires,ARG,Ciudad Autonoma De Buenos Aires,Universidad de Ciencias Empresariales y Sociales,124,-34.5983,-58.38711
Roma 650 - Olivos - Buenos Aires ,UCES Olivos,Vicente López,ARG,Buenos Aires,Universidad de Ciencias Empresariales y Sociales,527,-34.50255,-58.48491
Chile 343 - San Isidro - Buenos Aires ,UCES San Isidro,San Isidro,ARG,Buenos Aires,Universidad de Ciencias Empresariales y Sociales,529,-34.4653777,-58.5171637
Tucumán 2731 2731 - Santa Fe - Santa Fé ,Centro Regional Santa Fe,Santa Fe,ARG,Santa Fe,Universidad de Concepción del Uruguay,530,-31.6463729,-60.7084544
8 de junio 552 - Concepcion Del Uruguay - Entre Ríos ,Facultad de Arquitectura y Urbanismo,Uruguay,ARG,Entre Rios,Universidad de Concepción del Uruguay,531,-32.482044,-58.2302012
Pedernera 275 - Ciudad Autonoma de Buenos Aires - Ciudad Autonoma de Buenos Aires ,Facultad de Planeamiento,Ciudad de Buenos Aires,ARG,Ciudad Autonoma De Buenos Aires,Universidad de Flores,535,-34.63249,-58.46276
Mengelle 8 - Cipolletti - Río Negro ,Facultad de Planeamiento - Subsede Comahue,General Roca,ARG,Rio Negro,Universidad de Flores,537,-38.940768,-68.002598
Diagonal 80 723 - La Plata - Buenos Aires ,Facultad de Diseño y Comunicación,La Plata,ARG,Buenos Aires,Universidad del Este,541,-34.9073787,-57.9489728
Sarmiento 1565 - Ciudad Autonoma de Buenos Aires - Ciudad Autonoma de Buenos Aires ,Facultad de Artes,Ciudad de Buenos Aires,ARG,Ciudad Autonoma De Buenos Aires,Universidad del Museo Social Argentino,545,-34.60544,-58.38883
